,title,date,content
243,Air Liquide: finalise la cession d'entités à Messer,2020-05-04 17:57:00,"Le groupe Air Liquide annonce avoir finalisé la cession de ses entités en République tchèque et en Slovaquie au groupe Messer. 'Cette décision reflète la stratégie d'Air Liquide de revue régulière de son portefeuille d'activités afin d'accroître sa présence dans des régions clés, pour renforcer sa densité géographique, et dès lors sa performance', explique le groupe. Le montant de la transaction n'a pas été annoncé."
244,Air Liquide: les prévisions d'un analyste sur 2020,2020-04-27 14:03:00,"Crédit Suisse réduit ses prévisions de BPA de 5% au cours de l'exercice 2020. Le bureau d'analyses maintient sa recommandation à surperformance sur la valeur avec un objectif de 130 E. ' Air Liquide se négocie avec une remise de 8% par rapport à ses homologues américains ' indique le bureau d'analyses. ' Nous pensons qu'Air Liquide dispose d'un certain nombre de leviers pour protéger les bénéfices et la génération de cash tout au long du cycle '. Nous prévoyons un rendement du Free Cash Flow sur l'année 2020 de 6% ' rajoute Crédit Suisse. ' Les opportunités de fusions et acquisitions étant limitées, nous pensons qu'Air Liquide continuera de se concentrer sur l'augmentation progressive des rendements pour les actionnaires '."
245,Air Liquide: les prévisions sur 2020 de Crédit Suisse,2020-04-27 11:13:00,"Crédit Suisse réduit ses prévisions de BPA de 5% au cours de l'exercice 2020. Le bureau d'analyses maintient sa recommandation à surperformance sur la valeur avec un objectif de 130 E. ' Air Liquide se négocie avec une remise de 8% par rapport à ses homologues américains ' indique le bureau d'analyses. ' Nous pensons qu'Air Liquide dispose d'un certain nombre de leviers pour protéger les bénéfices et la génération de cash tout au long du cycle '. Nous prévoyons un rendement du Free Cash Flow sur l'année 2020 de 6% ' rajoute Crédit Suisse. ' Les opportunités de fusions et acquisitions étant limitées, nous pensons qu'Air Liquide continuera de se concentrer sur l'augmentation progressive des rendements pour les actionnaires '."
246,Air Liquide: Crédit Suisse confirme son conseil,2020-04-27 10:41:00,"Crédit Suisse réduit ses prévisions de BPA de 5% au cours de l'exercice 2010. Le bureau d'analyses maintient sa recommandation à surperformance sur la valeur avec un objectif de 130 E. ' Air Liquide se négocie avec une remise de 8% par rapport à ses homologues américains ' indique le bureau d'analyses. ' Nous pensons qu'Air Liquide dispose d'un certain nombre de leviers pour protéger les bénéfices et la génération de cash tout au long du cycle '. Nous prévoyons un rendement du Free Cash Flow sur l'année 2020 de 6% ' rajoute Crédit Suisse. ' Les opportunités de fusions et acquisitions étant limitées, nous pensons qu'Air Liquide continuera de se concentrer sur l'augmentation progressive des rendements pour les actionnaires '."
247,"Air Liquide: croissance comparable de 0,6% du CA trimestriel",2020-04-24 07:43:00,"Air Liquide publie un chiffre d'affaires de 5.370 millions d'euros au titre du premier trimestre 2020, en retrait de 1,3% en données publiées, mais en croissance comparable de 0,6% en dépit de la crise sanitaire. 'Cette bonne tenue des ventes reflète la solidité du modèle économique du groupe, caractérisé par la diversité de ses marchés et de ses géographies, ainsi que la part importante de contrats de long terme', commente le spécialiste des gaz industriels. Air Liquide estime que son résultat net récurrent 2020, c'est à dire hors plus value liée à la cession de Schülke et hors éléments exceptionnels significatifs, devrait être proche du résultat net récurrent 2019 à taux de change constant."
248,Air Liquide: 11 contrats long terme au 1er trimestre,2020-04-22 08:57:00,"Après une année 2019 record, avec 40 contrats à long terme de production sur site, Air Liquide annonce que sa branche d'activité industriel marchand a signé 11 nouveaux contrats de long terme au cours du premier trimestre. Signés avec les grands clients de sa branche d'activité, ces accords de longue durée garantissent un approvisionnement pendant au moins 10 ans. Les unités de production de gaz sur site sont installées, opérées et entretenues directement sur les sites des clients."
249,Air Liquide: investissement majeur à Taiwan,2020-04-21 09:02:00,"Dans le cadre d'un accord de long-terme avec un leader du marché des semi-conducteurs, Air Liquide annonce qu'il va investir près de 200 millions d'euros dans la construction de capacités de production dans les parcs scientifiques de Tainan et Hsinchu, à Taiwan. Cet investissement permettra au groupe français de gaz industriels de fournir trois grandes usines de production de semi-conducteurs en cours de construction, ainsi que les futurs centres de R&D pour circuits intégrés logiques parmi les plus avancés au monde. Les premières unités devraient démarrer au cours du deuxième trimestre 2021 afin de soutenir le développement des nouvelles usines de production de puces semi-conductrices du client, d'une valeur de plusieurs milliards de dollars."
250,"Air Liquide: vers le comblement du 'gap' des 122,65E du 6/3",2020-04-07 10:36:00,"Air Liquide tutoie désormais les 120E vers le comblement du 'gap' des 122,65E du 6/3: le titre ne devrait pas rencontrer d'obstacle avant les 122E (ex-plancher du 8 janvier puis du 28 février) et pourrait même se hisser jusque vers 123E, ex-zénith de fin novembre 2019."
251,Air Liquide: en négociations pour céder Schülke & Mayr,2020-04-07 09:08:00,"Air Liquide a annoncé être entré en négociations exclusives avec la société de capital-investissement EQT, en vue d'une cession éventuelle de sa filiale Schülke & Mayr GmbH, spécialisée dans la prévention des infections et l'hygiène. Ce projet de cession, annoncé en novembre 2019, correspond à la stratégie d'Air Liquide de révision régulière de son portefeuille d'actifs afin de se concentrer sur ses activités principales dans le domaine des gaz et de la santé, et ainsi de maximiser ses performances. Cette transaction sera soumise à l'accord final et définitif des parties, et sera réalisée dans le cadre des processus sociaux en vigueur. Elle devra également être validée par les autorités en charge de la concurrence et des investissements étrangers."
252,Air Liquide: Assemblée Générale à huis clos,2020-04-02 18:56:00,Air Liquide a souhaité privilégier cette année la convocation d'une Assemblée Générale à huis clos pour protéger la santé et la sécurité des collaborateurs et des actionnaires. Les actionnaires seront invités à suivre en direct l'Assemblée à distance. Les actionnaires auront la possibilité de poser des questions via une plateforme dédiée. ' Le Président répondra en direct le jour de l'Assemblée aux questions ayant suscité le plus d'intérêt ' précise le groupe. Les votes sur les résolutions et les pouvoirs au Président seront traités comme à l'accoutumée.
253,Air Liquide: groupe de travail avec d'autres industriels,2020-03-31 13:33:00,"Air Liquide, Groupe PSA, Schneider Electric et Valeo indiquent avoir mis en place un groupe d'une trentaine d'experts pour définir le plan d'actions pour augmenter la production des respirateurs Air Liquide Medical Systems déjà référencés par de nombreux hôpitaux. Cette initiative répond à la sollicitation du gouvernement, qui a demandé à un groupement d'industriels français, piloté par Air Liquide, d'étudier la possibilité d'augmenter la production de respirateurs pour en fournir 10.000 en 50 jours, de début avril à mi-mai. 'Ce défi industriel fera également appel à la contribution exceptionnelle de 100 entreprises partenaires pour assurer la fourniture des 300 composants essentiels à la fabrication de ces équipements médicaux', ajoute le spécialiste des gaz pour l'industrie et la santé."
254,Air Liquide: émission obligataire d'un milliard d'euros,2020-03-27 07:30:00,"Air Liquide indique avoir lancé avec succès une émission obligataire long terme d'un milliard d'euros, dont 500 millions sur une durée de cinq ans à un rendement actuariel de 1,022%, et 500 millions sur une durée de 10 ans à un rendement actuariel de 1,47%. Cette opération, 'très significativement sursouscrite par les investisseurs', a été réalisée dans le cadre de son programme Euro Medium Term Note (EMTN). Cette émission bénéficiera d'une notation 'A-' par S&P's et 'A3' par Moody's. Les fonds levés permettront au groupe de gaz industriels de 'refinancer par anticipation les échéances obligataires de juin 2020, et de continuer à financer de manière durable sa croissance à long terme, et ce dans des conditions très compétitives'."
255,Air Liquide: pourrait relever le prix de vente de Schülke,2020-03-16 10:55:00,"Le groupe voudrait faire relever le prix de vente de sa filiale Schülke indique ce matin le FT. La société Schülke, dont le siège social est situé en Allemagne, est un leader dans le domaine de l'infection, de la prévention et de l'hygiène. Avec 130 ans d'expérience, elle compte plus de 1.200 collaborateurs dans 22 pays. ' Air Liquide espérait retirer 1 MdE environ de cette cession. Après une telle crise, il parait raisonnable d'imaginer que la demande de long terme pour les produits d'hygiène devrait être révisée à la hausse ' indique ce matin Aurel BGC. La cession de sa filiale Schülke, permettra au groupe de 'continuer à développer ses activités santé, tout en permettant à Schülke de bénéficier des meilleures opportunités pour son développement à long terme'. ' Rien ne garantit avec certitude qu'il en résultera un désinvestissement effectif', a précisé toutefois le fournisseur de gaz industriels."
256,Air Liquide: voudrait relever le prix de vente de Schülke,2020-03-16 10:03:00,"Le groupe voudrait faire relever le prix de vente de sa filiale Schülke indique ce matin le FT. La société Schülke, dont le siège social est situé en Allemagne, est un leader dans le domaine de l'infection, de la prévention et de l'hygiène. Avec 130 ans d'expérience, elle compte plus de 1.200 collaborateurs dans 22 pays. ' Air Liquide espérait retirer 1 MdE environ de cette cession. Après une telle crise, il parait raisonnable d'imaginer que la demande de long terme pour les produits d'hygiène devrait être révisée à la hausse ' indique ce matin Aurel BGC. La cession de sa filiale Schülke, permettra au groupe de 'continuer à développer ses activités santé, tout en permettant à Schülke de bénéficier des meilleures opportunités pour son développement à long terme'. ' Rien ne garantit avec certitude qu'il en résultera un désinvestissement effectif', a précisé toutefois le fournisseur de gaz industriels."
257,Air Liquide: négocie la cession de CRYOPDP,2020-03-02 17:51:00," Le groupe Air Liquide annonce ce soir être entré en négociations exclusives avec la société de capital-investissement française Hivest Capital Partners, en vue d'une cession de sa filiale CRYOPDP. 'Cette décision correspond à la stratégie d'Air Liquide de révision régulière de son portefeuille d'actifs afin de se concentrer sur les activités ou territoires clefs du Groupe et ainsi maximiser ses performances', indique le groupe. Cette opération reste 'soumise à l'accord final et définitif entre les parties'."
258,Air Liquide: BlackRock abaisse sa participation,2020-03-02 12:26:00,"La société BlackRock agissant pour le compte de clients et de fonds dont elle assure la gestion, a déclaré avoir franchi en baisse, le 27 février 2020, les seuils de 5% du capital et des droits de vote de la société Air Liquide et détenir, pour le compte desdits clients et fonds, 23 543 504 actions Air Liquide représentant autant de droits de vote, soit 4,98% du capital et des droits de vote de cette société. Ce franchissement de seuils résulte d'une diminution du nombre d'actions Air Liquide détenues à titre de collatéral."
259,Air Liquide: BlackRock dépasse les 5% -Air Liquide,2020-02-25 10:17:00,"BlackRock, agissant pour le compte de clients et de fonds dont elle assure la gestion, a déclaré à l'AMF avoir franchi en hausse, le 21 février, les seuils de 5% du capital et des droits de vote d'Air Liquide et détenir 5,01% du capital et des droits de vote. Le gestionnaire d'actifs américain précise que ce franchissement de seuils résulte d'une acquisition d'actions hors et sur le marché et d'une augmentation du nombre d'actions détenues à titre de collatéral."
260,Air Liquide: succès commercial de Turbo-Brayton,2020-02-19 09:08:00,"Air Liquide revendique une cinquantaine d'équipements cryogéniques Turbo-Brayton vendus ces deux dernières années, pour une valeur totale de près de 180 millions d'euros, permettant d'éviter plus de 240.000 tonnes d'émissions de CO2-équivalent par an. Le fournisseur français de gaz pour l'industrie et la santé précise que ces équipements sont destinés à être installés sur des méthaniers, qu'il s'agisse de bâtiments neufs ou de la modernisation de navires existants. Cette technologie d'Air Liquide a d'abord été utilisée dans le domaine spatial, pour conserver au froid des échantillons biologiques dans la Station Spatiale Internationale, puis adaptée pour le marché maritime."
261,Air Liquide: BlackRock a baissé sa participation,2020-02-17 12:29:00,"La société BlackRock agissant pour le compte de clients et de fonds dont elle assure la gestion, a déclaré avoir franchi en baisse, le 13 février 2020, les seuils de 5% du capital et des droits de vote de la société Air Liquide et détenir, pour le compte desdits clients et fonds, 23 524 120 actions Air Liquide représentant autant de droits de vote, soit 4,97% du capital et des droits de vote de cette société. Ce franchissement de seuils résulte d'une diminution du nombre d'actions Air Liquide détenues à titre de collatéral."
262,"Air Liquide: en hausse de 6,1% du résultat net annuel",2020-02-11 07:39:00,"Air Liquide publie un résultat net part du groupe de 2.242 millions d'euros en 2019, en hausse de 6,1% (+6,7% hors application de la norme IFRS16) et une marge opérationnelle de 17,3%, représentant une amélioration de 90 points de base. Le chiffre d'affaires du fournisseur de gaz pour l'industrie et la santé s'établit à 21.920 millions d'euros, en croissance publiée de 4,3% et en hausse comparable de 3,2%, dont des ventes gaz et services en croissance comparable de 3,5%. Le conseil d'administration proposera un dividende de 2,70 euros par action. A la suite de l'attribution d'actions gratuites d'une pour 10 réalisée en octobre dernier, le dividende proposé représente une forte croissance de 12,4%. En 2020, en l'absence de changement majeur de l'environnement et dans un contexte de maîtrise de la situation sanitaire internationale, Air Liquide se dit confiant dans sa capacité à augmenter sa marge opérationnelle et à réaliser une croissance du résultat net, à change constant."
263,Air Liquide: nouveaux contrats avec BASF en Belgique,2020-02-10 09:08:00,"Air Liquide et BASF annoncent avoir signé trois nouveaux contrats de long terme dans le bassin d'Anvers (Belgique), bassin industriel où le groupe français de gaz industriels exploite actuellement cinq usines de production sur ce site. Un nouvel accord de 15 ans correspond d'une part, au renouvellement du contrat de fourniture de gaz de l'air pour les unités existantes et d'autre part, à la fourniture d'oxygène supplémentaire à une nouvelle usine d'oxyde d'éthylène que BASF va construire. Air Liquide construira et exploitera aussi une unité de déazotation pour fournir à BASF des gaz de grande pureté pour une production plus efficace de MDI. Enfin, il achètera une part du méthane issu du processus de production de BASF et le valorisera comme matière première."
264,Air Liquide: nouvelle note 'A' de la part du CDP,2020-02-07 13:25:00,"Air Liquide annonce s'être vu attribuer, pour la seconde fois cette année, la note 'A' dans le classement du CDP, organisation à but non lucratif, cette fois-ci pour le reporting de ses actions en matière de gestion durable de l'eau. 'Avec ce score qui complète celui reçu pour le climat, Air Liquide rentre ainsi dans le cercle très fermé des sociétés ayant obtenu un double 'A' par le CDP', souligne le fournisseur français de gaz pour l'industrie et la santé. En 2019, plus de 8.400 sociétés ont mis à disposition du CDP les données relatives à leurs impacts environnementaux pour évaluation indépendante. Parmi elles, 38 ont obtenu un triple ou un double A, dont trois françaises parmi lesquelles Air Liquide."
265,Air Liquide: négocie la cession de deux entités en Europe,2020-01-28 17:59:00," Air Liquide annonce ce soir être entré en négociations exclusives avec Messer, en vue de la cession de ses entités en République tchèque et en Slovaquie. Air Liquide est présent en Slovaquie depuis l'an 2000 et en République tchèque depuis 2001. Les deux entités comprennent au total 53 collaborateurs, avec des bureaux situés à Prague et Trnava. 'Cette décision reflète la stratégie d'Air Liquide de revue régulière de son portefeuille d'activités afin d'accroître sa présence dans des régions clés, pour renforcer sa densité géographique, et dès lors sa performance', explique le groupe."
266,Air Liquide: a renouvelé son partenariat avec Solidia,2020-01-27 18:04:00,"Air Liquide annonce avoir renouvelé son partenariat avec Solidia Technologies. Cette société développe des solutions qui permettent de réduire l'empreinte environnementale du béton préfabriqué. Air Liquide est le fournisseur privilégié de Solidia en CO2 et en matériel utilisé pour son injection. Airgas aux Etats-Unis, filiale d'Air Liquide, fournit le dioxyde de carbone en récupérant et purifiant le CO2 émis par d'autres industries. Le béton Solidia est déjà en phase de développement commercial. Matthieu Giard, Vice-Président, membre du comité exécutif du groupe Air Liquide et Directeur de la branche d'activité Industriel Marchand, a déclaré: 'Basée sur une utilisation innovante du CO2, cette technologie constitue une solution particulièrement intéressante pour réduire l'empreinte carbone du béton préfabriqué'."
267,Air Liquide: intégré à la liste A du CDP -Air Liquide,2020-01-24 08:09:00,"Air Liquide indique qu'il vient de rejoindre la 'Liste A' du CDP (anciennement 'Carbon Disclosure Project'), une organisation à but non lucratif qui évalue les entreprises sur leurs actions en faveur du climat. La note 'A', la plus haute note délivrée par le CDP, distingue le groupe français de gaz industriels comme l'une des entreprises les plus engagées en matière de lutte contre le changement climatique. Il s'est engagé à réduire de 30% son intensité carbone d'ici 2025. Chaque année, Air Liquide consacre environ 100 millions d'euros de dépenses d'innovation pour réduire son empreinte carbone ou celle de ses clients. Près de 40% de ses décisions d'investissements du groupe répondent à des enjeux environnementaux et climatiques."
268,Air Liquide: offre aux diabétiques étendue en Europe,2020-01-16 09:08:00,"Air Liquide indique élargir son offre de services de santé à domicile aux patients diabétiques à l'Allemagne, la Belgique, aux Pays-Bas et au Luxembourg : il accompagnera ainsi désormais des patients diabétiques dans 10 pays en Europe. Le groupe a choisi en Allemagne et au Benelux la technologie de Tandem Diabetes Care, fabricant d'équipements médicaux destinés aux patients diabétiques, afin de proposer des pompes à insuline de dernière génération, dans le cadre de son offre de services. Cette pompe à insuline, associée à un système de mesure de glucose en continu, permet d'anticiper les risques d'hypoglycémie et de suspendre automatiquement la délivrance d'insuline. Air Liquide est déjà partenaire de Tandem Diabetes Care dans d'autres pays européens."
269,Air Liquide: BlackRock passe sous les 5% -Air Liquide,2020-01-08 12:52:00,"BlackRock, agissant pour le compte de clients et de fonds, a déclaré à l'AMF avoir franchi en baisse, le 6 janvier, les seuils de 5% du capital et des droits de vote d'Air Liquide et détenir 4,98% du capital et des droits de vote du fournisseur de gaz industriels. Le gestionnaire d'actifs américain précise que ce franchissement de seuils résulte d'une diminution du nombre d'actions détenues à titre de collatéral."
270,Air Liquide: BlackRock est monté dans le capital,2020-01-06 17:19:00,"La société BlackRock, Inc. agissant pour le compte de clients et de fonds dont elle assure la gestion, a déclaré avoir franchi en hausse, le 3 janvier 2020, les seuils de 5% du capital et des droits de vote de la société Air Liquide et détenir, pour le compte desdits clients et fonds, 23 668 798 actions Air Liquide représentant autant de droits de vote, soit 5,003% du capital et des droits de vote de cette société. Ce franchissement de seuils résulte d'une acquisition d'actions Air Liquide hors et sur le marché et d'une augmentation du nombre d'actions Air Liquide détenues à titre de collatéral."
271,Air Liquide: une fin d'année boursière en fanfare ?,2019-12-20 17:08:00,
272,Air Liquide: nouveau record absolu pour couronner 2019,2019-12-20 10:25:00,"Air Liquide établit un nouveau record absolu au-delà de 126,7E pour couronner 2019, avec un score de +29% depuis le 1et janvier (un tout petit peu mieux que le CAC40, un peu moins bien que le CAC40 'GR'). Parti d'un plancher de 92,8E en 2019, le titre pouvait viser un objectif de 128E, via un dérivé du 'Fibo' de +38,2%: il est pratiquement atteint."
273,Air Liquide: BlackRock repasse sous le seuil des 5%,2019-12-06 15:31:00,"La société BlackRock, Inc. agissant pour le compte de clients et de fonds dont elle assure la gestion, a déclaré avoir franchi en baisse, le 4 décembre 2019, les seuils de 5% du capital et des droits de vote de la société Air Liquide et détenir, pour le compte desdits clients et fonds, 23 390 626 actions Air Liquide représentant autant de droits de vote, soit 4,94% du capital et des droits de vote de cette société. Ce franchissement de seuils résulte d'une cession d'actions Air Liquide hors marché et d'une diminution du nombre d'actions Air Liquide étenues à titre de collatéral."
274,Air Liquide: BlackRock a allégé sa participation,2019-12-06 12:13:00,"Un avis publié ce matin par l'Autorité des marchés financiers relaie la déclaration selon laquelle le 4 décembre, la méga-gestion américaine BlackRock a franchi en baisse les seuils de 5% du capital et des droits de vote d'Air Liquide. A cette date, pour le compte de ses fonds et de ses clients, et après la cession de titres hors marché et une restitution d'actions détenues à titre de collatéral, BlackRock pointait à 4,94% des parts et des voix du géant français des gaz industriels et médicaux."
275,Air Liquide: avenant à sa ligne de crédit syndiquée,2019-12-03 08:55:00,"Air Liquide annonce avoir conclu aujourd'hui un avenant à sa ligne de crédit syndiquée de 2 milliards d'euros prévoyant désormais un mécanisme de corrélation entre ses coûts financiers et trois de ses objectifs RSE dans le domaine de l'intensité carbone, de la diversité homme-femme, et de la sécurité. ' Acteur industriel engagé en faveur du développement durable, Air Liquide témoigne par cette initiative de sa volonté de combiner performance et responsabilité ' indique le groupe. Désormais, un mécanisme d'indexation prévoit une augmentation ou diminution du coût de financement et des commissions payées en fonction de l'atteinte d'objectifs fixés annuellement pour chaque critère. Fabienne Lecorvaisier, Directeur Général Adjoint et Directeur Financier du Groupe, a déclaré : ' La mise en place d'un mécanisme financier qui lie coûts financiers et performance extra-financière est une matérialisation de plus de notre engagement. Après avoir été le premier émetteur d'une émission obligataire ISR en 2012, nous continuons ainsi à participer au développement de mécanismes de finance responsable au service d'une croissance durable."
276,"Air Liquide: vulnérabilité inattendue, rechute sous 120E",2019-12-02 19:00:00,"Air Liquide fait preuve d'une vulnérabilité inattendue: le titre rechute de -2,7%, sous 120E après avoir ricoché sous 123E vendredi 29/11. Le titre efface tous ses gains depuis le 13/11 alors qu'il sous-performait déjà le CAC40. Plusieurs supports se dessinent à court terme, vers 118,6E (plancher du 12/11) puis 116E (plancher du 22/10)."
277,Air Liquide: BlackRock est monté dans le capital,2019-12-02 14:44:00,"La société BlackRock, Inc. agissant pour le compte de clients et de fonds dont elle assure la gestion, a déclaré avoir franchi en hausse, le 28 novembre 2019, les seuils de 5% du capital et des droits de vote de la société Air Liquide et détenir, pour le compte desdits clients et fonds, 23 797 830 actions Air Liquide représentant autant de droits de vote, soit 5,03% du capital et des droits de vote de cette société. Ce franchissement de seuils résulte d'une augmentation du nombre d'actions Air Liquide détenues à titre de collatéral."
