,title,date,content
0,Air Liquide: nouveaux PPA avec Sasol en Afrique du Sud,2023-11-21 09:23:00,"Air Liquide a annoncé mardi avoir signé de nouveaux contrats de long terme avec le sud-africain Sasol portant sur des capacités d'électricité renouvelable de 100 MW au niveau du site de Secunda. Le partenariat a été conclu avec le fournisseur d'énergie éolienne et solaire Mainstream Renewable Power, qui a été chargé de construire une ferme solaire qui devrait être opérationnelle en 2025. Il s'agit de la troisième série de 'PPA' conclus par Air Liquide et Sasol, après ceux déjà annoncés en début d'année avec Enel Green Power et avec TotalEnergies et son partenaire Mulilo. Ces accords doivent contribuer à l'objectif d'Air Liquide de réduire de 30% à 40% les émissions de CO2 liées à la production d'oxygène d'ici 2031 à Secunda, où le groupe exploite le plus grand site de production d'oxygène au monde. Pour mémoire, Air Liquide a racheté à Sasol les 16 unités de production d'oxygène de ce dernier à Secunda, qu'il exploite désormais depuis juin 2021. En tenant compte d'une autre unité de séparation des gaz de l'air (ASU) que le groupe opérait déjà pour Sasol, Air Liquide exploite un total de 17 ASU à Secunda, pour une capacité totale de 47.000 tonnes d'oxygène par jour."
1,Air Liquide: allié à Eneos pour l'hydrogène bas carbone,2023-11-15 09:28:00,"Air Liquide annonce la signature avec Eneos Corporation, leader japonais de l'énergie, d'un protocole d'accord pour étudier le développement de la production d'hydrogène bas carbone, en ayant recours aussi bien aux technologies de CCUS que d'électrolyse. En outre, les deux groupes examineront les possibilités de collaborations en matière de développement d'une chaîne logistique internationale d'hydrogène liquide pour approvisionner le marché japonais à partir de l'étranger. Enfin, ce partenariat étudiera des initiatives communes pour développer la mobilité hydrogène au Japon, y compris via une infrastructure de stations-service d'hydrogène, et une collaboration en matière d'innovation sur la chaîne de valeur de l'hydrogène."
2,Air Liquide: inaugure une usine avec Siemens à Berlin,2023-11-08 17:27:00,"Air Liquide et Siemens ont officiellement inauguré ce mercredi leur nouvelle usine berlinoise, destinée à la production d'électrolyseurs hydrogène renouvelable de grande taille. Cette entrée en production - qui représente un investissement de quelque 30 millions d'euros - doit précéder une montée en puissance dans les années qui viennent, avec un objectif de capacité annuelle de trois gigawatts d'ici 2025. A titre d'indication, une puissance de trois gigawatts est censée permettre la production annuelle de 300.000 tonnes métriques d'hydrogène vert, soit l'équivalent de la consommation théorique d'une grande ville comme Aachen en Allemagne (260.000 habitants). L'un des premiers projets concernés est celui de l'électrolyseur Air Liquide Normand'Hy, qui doit afficher une capacité de 200 mégawatts dans une première phase et dont l'assemblage est prévu en France. L'inauguration s'est déroulée en présence du Chancelier allemand Olaf Scholz, du patron de Siemens Energy Christian Bruch et du directeur général d'Air Liquide, Francois Jackow."
3,Air Liquide: offre de rachat partiel d'obligations,2023-11-06 14:15:00,"Air Liquide annonce le lancement d'une offre de rachat partiel en numéraire, pour un montant maximum d'acceptation total de 300 millions d'euros en principal d'obligations, une opération qui participera à l'optimisation de la structure de financement du groupe. Cette offre porte sur trois souches obligataires venant à maturité en juin 2024 ou en avril 2025, et portant des coupons de respectivement 1,875%, 0,750% et 1,000%. Ces obligations sont admises aux négociations sur le marché réglementé de la Bourse de Luxembourg. L'offre de rachat sera ouverte de ce 6 novembre jusqu'à 16h00 (heure de Paris) le 13 novembre et son résultat final sera annoncé le 14 novembre dès que possible après l'heure de fixation du prix des obligations à échéance avril 2025."
4,Air Liquide: début d'une opération d'actionnariat salarié,2023-10-31 07:08:00,"Air Liquide annonce une opération d'augmentation de capital réservée aux salariés, opération qui couvrira près de soixante pays, pour 'associer encore davantage ses collaborateurs au développement du groupe et à ses performances dans la durée'. Le prix de souscription des actions a été fixé à 126,49 euros, et l'opération portera sur un nombre maximum de 750.000 actions. La période de souscription se déroulera du 6 novembre à 9 heures au 16 novembre à midi (heure de Paris). Les nouvelles actions seront immédiatement assimilées aux anciennes et bénéficieront des mêmes droits. Elles seront bloquées pendant cinq ans, sauf cas de déblocage anticipé prévus par les réglementations applicables en France et dans les pays participants."
5,"Air Liquide: hausse de 1,5% du CA trimestriel en comparable",2023-10-25 08:40:00,"Air Liquide affiche un chiffre d'affaires de 6,81 milliards d'euros au titre du troisième trimestre 2023, en chute de 17,4% en données brutes du fait de la baisse des prix de l'énergie et d'un effet de change négatif, mais en hausse de 1,5% à données comparables. L'activité gaz et services, qui représente 95% du chiffre d'affaires du groupe, s'est inscrite en hausse comparable de 1,7%, l'industriel marchand et la santé ayant été les moteurs de la croissance de cette activité. Pour l'ensemble de 2023, Air Liquide se dit confiant dans sa capacité à augmenter à nouveau sa marge opérationnelle et à réaliser une croissance du résultat net récurrent, à change constant, des perspectives 'soutenues par des décisions d'investissement record'."
6,Air Liquide: plateforme pour du gaz bas carbone au Québec,2023-10-25 07:43:00,"Air Liquide annonce la création d'une plateforme innovante de production de gaz bas carbone, parmi lesquels de l'hydrogène, de l'oxygène, de l'azote et de l'argon, à Bécancour, au Québec, représentant un investissement de plus de 140 millions d'euros. L'infrastructure que le groupe va mettre en place comprendra une nouvelle unité de production d'oxygène et d'azote renouvelables, ainsi qu'une capacité de stockage liquide, reliés par un réseau de canalisations local pour mieux servir ses clients. La nouvelle plateforme approvisionnera principalement, dans le cadre de contrats à long terme, des clients fabriquant des composants de batteries pour véhicules électriques. Elle devrait être opérationnelle en 2025."
7,Air Liquide: contrat PPA conclu avec Vattenfall au Benelux,2023-10-24 09:21:00,"Air Liquide a annoncé mardi qu'il allait assurer 70% de ses besoins en électricité renouvelable au Benelux grâce à la signature d'un nouveau contrat de long terme avec le suédois Vattenfall. Le producteur de gaz industriels explique que ce second contrat d'achat d'énergie renouvelable (PPA) conclu avec la compagnie scandinave pour une puissance installée de 115 MW va lui permettre de renforcer significativement son approvisionnement dans la région. Signé pour une durée de 15 ans à compter de 2026, ce nouveau PPA portera la puissance installée totale de production d'électricité renouvelable à la disposition d'Air Liquide à environ 270 MW au Benelux, soit plus de 70% de sa consommation d'électricité actuelle dans la région. Cette électricité doit êtrera générée par le parc éolien offshore Hollandse Kust Zuid (HKZ) de Vattenfall, situé au large des côtes néerlandaises."
8,"Air Liquide : gare à la cassure des 154,75E",2023-10-20 14:27:00,"La pépite Air Liquide valide la cassure du support des 154,75E du 7 juillet et entame un mouvement de correction en direction de 146,5, le palier de soutien testé le 135 mars dernier. L'objectif suivant serait 142,3, le plancher du 10 fvrier dernier... niveau qui coïncide vec 50% de retracement de la hausse le 27 septembre 2022 depuis un plancher de 116E."
9,"Air Liquide: double-top sous 168,5E -Air Liquide",2023-09-20 15:13:00,"Air Liquide matérialise un double-top parfait sous 168,5E les 31 août et 15 septembre, et c'est également le 3ème plafonnement très précisément au contact des 167,5/168E depuis les 16 juin dernier (clôture à 167,94E). La tendance haussière est invalidée par la franche cassure des 164E (support oblique), ce qui libère un potentiel de repli vers 156,6E puis surtout 154,8E, le plancher du 7 juillet dernier."
10,"Air Liquide : nouveau record à 168,06E -Air Liquide",2023-09-18 19:45:00,"Air Liquide -qui figure toujours parmi les favorites des gérants de portefeuilles- a conclu le 3ème trimestre 2023 par un nouveau record de clôture à 168,06E (cette marque avait déjà été atteinte mais seulement en intraday le 31 août). L'entame du 4ème trimestre est moins glorieuse mais la tendance haussière moyen terme (point origine 115E le 29/098/2022) reste valide tant que les 164E (support oblique) ne seront pas enfoncés. Attention cependant au triple-top : c'est le 3ème plafonnement dans la zone des 167,5/168E depuis les 16 juin dernier (clôture à 167,94E)."
11,Air Liquide: investissement dans un électrolyseur,2023-09-14 09:22:00,"A l'occasion de la signature d'un protocole d'accord avec TotalEnergies pour sa raffinerie de Gonfreville, Air Liquide annonce un investissement de plus de 400 millions d'euros pour la construction de son électrolyseur Normand'Hy, d'une capacité de 200 MW. Cet électrolyseur livrera sur le long terme à la raffinerie de l'hydrogène renouvelable et bas carbone, correspondant à une capacité d'électrolyse de 100 MW, à partir du second semestre 2026. Les 100 MW restants seront destinés à d'autres clients. Afin d'alimenter l'électrolyseur, TotalEnergies produira de l'électricité renouvelable à hauteur de 100 MW. Pour le reste des besoins en électricité de l'électrolyseur, Air Liquide prévoit des contrats à long terme d'approvisionnement en énergie renouvelable."
12,Air Liquide: nouvelle directrice des ressources humaines,2023-09-08 07:43:00,"Air Liquide annonce la nomination d'Amelia Irion au poste de directrice des ressources humaines et membre du comité exécutif, à compter du 18 septembre, succédant à Armelle Levieux qui prendra de nouvelles responsabilités au sein du groupe de gaz industriels. Amelia Irion apporte plus de 25 ans d'expérience internationale dans le domaine des ressources humaines. De 2020 à 2023, elle a occupé le poste de directrice des ressources humaines de Colas, où elle était membre du comité exécutif et du comité stratégique."
13,"Air Liquide: se hisse à 165E, record absolu à portée de main",2023-08-24 13:01:00," Air Liquide se hisse à 165E, le record absolu des 167,9E (testé durant quelques minutes seulement le 16 juin) est à portée de main. Le niveau 168E correspond au passage d'une résistance long terme unissant les précédents sommets absolus."
14,Air Liquide: Berenberg passe à une recommandation d'achat,2023-08-24 12:31:00,"Berenberg a relevé jeudi sa recommandation sur le titre Air Liquide à 'acheter' contre 'conserver' jusqu'à présent, avec un objectif de cours rehaussé de 165 à 178 euros. Dans sa note de recherche, l'établissement allemand salue la discipline opérationnelle 'meilleure que prévu' dont fait preuve selon lui le groupe industriel. 'La raison pour laquelle nous avons affiché pendant un certain temps une opinion neutre sur Air Liquide tenait à nos inquiétudes concernant d'éventuels surinvestissements dans le segment très fragmenté de l'hydrogène et de l'ammoniac', souligne l'intermédiaire. Berenberg explique qu'il redoutait que cette stratégie ne conduise le groupe à s'émoigner de son modèle économique traditionnel basé sur les contrats d'achat fermes ('take-or-pay') si caractéristique du secteur. 'Les derniers trimestre ont, au contraire, apporté la preuve que la société prêtait attention à sa politique d'investissement, malgré un bilan renforcé qui pourrait l'encourager à multiplier les dépenses', conclut-il."
15,"Air Liquide: le titre monte, Berenberg passe à l'achat",2023-08-24 11:01:00,"Air Liquide enregistre la deuxième plus forte hausse de l'indice CAC 40 ce jeudi à la Bourse de Paris suite à un relèvement de recommandation de Berenberg, passé à l'achat sur le titre. Peu avant 10h30, le titre du spécialiste français des gaz industriels s'adjuge 1,6%, juste derrière Capgemini (+1,9%) qui profite de l'engouement pour les valeurs technologiques après les bons résultats publiés par Nvidia. Berenberg a relevé ce matin sa recommandation sur Air Liquide à 'acheter' contre 'conserver' jusqu'à présent, avec un objectif de cours rehaussé de 165 à 178 euros. Dans sa note de recherche, l'établissement allemand salue la discipline opérationnelle 'meilleure que prévu' dont fait preuve selon lui le groupe industriel. 'La raison pour laquelle nous avons affiché pendant un certain temps une opinion neutre sur Air Liquide tenait à nos inquiétudes concernant d'éventuels surinvestissements dans le segment très fragmenté de l'hydrogène et de l'ammoniac', souligne l'intermédiaire. Berenberg explique qu'il redoutait que cette stratégie ne conduise le groupe à s'émoigner de son modèle économique traditionnel basé sur les contrats d'achat fermes ('take-or-pay') si caractéristique du secteur. 'Les derniers trimestre ont, au contraire, apporté la preuve que la société prêtait attention à sa politique d'investissement, malgré un bilan renforcé qui pourrait l'encourager à multiplier les dépenses', souligne-t-il. En Bourse, l'action Air Liquide affiche dorénavant une hausse de plus de 24% depuis le début de l'année, ce qui en fait l'une des plus fortes progressions annuelles de l'indice CAC 40 aux côtés de STM, Hermès, Saint-Gobain, Stellantis et Safran."
16,Air Liquide: BPA accru de 32% au 1er semestre,2023-07-27 08:18:00,"Air Liquide publie un BPA en progression de 32% au titre du premier semestre 2023, à 3,30 euros, avec une marge opérationnelle (ROC sur chiffre d'affaires) de 17,7%, en forte amélioration de 80 points de base hors effet énergie. Le chiffre d'affaires du groupe de gaz industriels s'est établi à près de 14 milliards d'euros, en retrait publié de 1,6% sur des effets énergie (-4,7%) et de change (-2,1%) défavorables, mais en croissance comparable de 4,9%. 'En 2023, Air Liquide est confiant dans sa capacité à augmenter à nouveau sa marge opérationnelle et à réaliser une croissance du résultat net récurrent, à change constant', affirme son directeur général François Jackow."
17,Air Liquide: investissement dans deux sites en Asie,2023-07-21 09:15:00,"Air Liquide annonce investir près de 200 millions de dollars dans deux nouveaux centres de production de matériaux avancés à Taïwan et en Corée du Sud, à proximité de ses clients dans l'industrie des semi-conducteurs et en réponse à leurs besoins. 'Cela permettra d'accélérer, grâce à une collaboration étroite, les innovations, le développement de solutions et une production fiable et de grande qualité, à pleine capacité', explique le fournisseur français de gaz industriels. Ces installations, qui devraient être opérationnelles en 2024 et 2025 respectivement, seront modulaires et flexibles, et intégreront en outre des systèmes numériques de contrôle de la qualité, afin de répondre aux besoins des clients, en constante évolution."
18,Air Liquide: projet d'ammoniac bas carbone avec KBR,2023-07-19 09:43:00,"Air Liquide annonce qu'il va, à travers son activité ingénierie et construction, collaborer avec KBR pour proposer des solutions technologiques pour la production d'ammoniac bas carbone intégrant son procédé de reformage autothermique (ATR). Le groupe de gaz industriels explique que ces solutions contribueront au développement d'un marché global de l'hydrogène bas carbone dans la mesure où, transformé en ammoniac, l'hydrogène peut facilement être transporté sur de longues distances. 'Le marché global de l'ammoniac a atteint près de 78 milliards de dollars en 2022 et devrait dépasser 129 milliards d'ici 2030 ; il est attendu en croissance annuelle moyenne de 6,5% entre 2022 et 2030, selon Precedence Research', souligne-t-il par ailleurs."
19,Air Liquide: prêt vert de 67 ME pour un projet hydrogène,2023-07-18 18:27:00,"Air Liquide fait savoir que dans le cadre de sonprojetde construction de deux unités de production d'hydrogène bas carbone et des infrastructures associées dans le Parc industriel chimique de Shanghai (SCIP), sa filiale Shanghai Chemical Industry Park Industrial Gases Co., Ltd (SCIPIG), a signé un Prêt Vert bilatéral de 500 millions de renminbis (environ 67 millions d'euros) avec BNP Paribas en tant que seule banque prêteuse et conseil vert. CePrêt Vertest le premier accordé dans le monde pour financer une production d'hydrogène bas-carbonerespectant les principes communs auxtaxonomies vertes de la Chine et de l'Union Européenne. SCIPIG assurera un suivi régulier des bénéfices de ce projet sur le plan environnemental. Ces unités de production sont destinées à remplacer l'approvisionnement provenant d'une unité de gazéification de charbon appartenant à un tiers, elles permettront d'éviter l'émission de 350 000 tonnes de CO2par an, assure Air Liquide."
20,Air Liquide: Stifel confirme sa recommandation,2023-07-07 15:14:00,"Stifel maintient son conseil d'achat sur le titre Air Liquide avec un objectif de cours inchangé de 178 euros. L'analyste estime que Air Liquide devrait à nouveau être en mesure de prouver son modèle économique robuste avec 'une croissance comparable positive et un EBIT en hausse au 2e trimestre'. Stifel rappelle néanmoins que l'entreprise n'échappe pas au contexte économique et qu'après une croissance de 6,6% du segment Gaz au 1er trimestre, la croissance devrait se limiter à +2,5% au 2e trimestre sur ce même secteur. L'analyste indique d'ailleurs que le secteur des grandes industries est attendu en recul dans toutes les régions Grandes industries mais que la santé devrait continuer sur une bonne dynamique. Stifel souligne enfin que les vents contraires liés aux effets de change se sont intensifiés et pèseront quelque -4% au 2e trimestre."
21,Air Liquide: projet de transformation d'une activité,2023-07-06 07:36:00,"La Direction des activités Santé d'Air Liquide a présenté à ses partenaires sociaux un projet de transformation de son activité Santé à Domicile en France. ' Ainsi, en tant que partenaire clé du système de santé, Air Liquide entend contribuer de manière responsable à sa nécessaire transformation en définissant un nouveau modèle d'organisation pour ses activités Santé à Domicile en France ' indique le groupe. Le projet de transformation présenté aux partenaires sociaux consisterait ainsi à remodeler l'organisation opérationnelle de l'une des principales entités de santé à domicile du Groupe, Pharma Dom, à simplifier son portefeuille de marques, et à regrouper certaines de ses implantations. Il viserait, par ailleurs, à rassembler au sein d'une même entité certaines fonctions transverses. Actuellement soumis à la consultation des instances représentatives du personnel, ce projet impliquerait la suppression de 430 postes nets. ' Air Liquide Healthcare souhaite proposer des nouveaux modèles de prise en charge à domicile, permettant une meilleure organisation des parcours de soins et qualité de vie pour les patients et ce, au meilleur coût pour le système de santé. Cette transformation, indispensable, sera menée en concertation avec nos partenaires sociaux ' a déclaré Philippe Ogé, Directeur général Santé à Domicile France."
22,Air Liquide: cession de la participation dans Hydrogenics,2023-06-30 09:21:00,"Air Liquide a annoncé vendredi qu'il allait vendre sa participation minoritaire de 19% au sein d'Hydrogenics, un spécialiste de la production d'hydrogène et des piles à combustible, à l'américain Cummins, qui détient les 81% restants de la société. Dans un communiqué, le producteur français de gaz industriels explique que l'opération s'inscrit dans le cadre de la 'revue régulière' de son portefeuille d'actifs. Il se dit malgré tout 'plus que jamais engagé' dans le développement de l'hydrogène, notamment en ce qui concerne l'exploitation d'électrolyseurs de grande taille. Une fois détenu à 100% par Cummins, Hydrogenics restera l'un des fournisseurs d'Air Liquide pour des projets d'électrolyseurs, précise le groupe."
23,Air Liquide: de l'hydrogène pour Paris 2024,2023-06-26 10:37:00,"Air Liquide annonce avoir conclu un partenariat avec le Comité d'Organisation des Jeux Olympiques et Paralympiques de Paris 2024, reposant sur l'avitaillement en hydrogène des véhicules transportant les athlètes et les officiels. Plusieurs centaines de voitures à hydrogène Toyota Mirai seront ainsi avitaillées en hydrogène fourni par le groupe, de l'hydrogène qui sera d'origine renouvelable, c'est-à-dire produit à partir d'électrolyse de l'eau ou de biométhane avec garanties d'origine. Air Liquide initie, pilote et développe actuellement parmi les plus grands projets mondiaux pour décarboner l'industrie et les transports, grâce notamment à l'hydrogène. Il s'est ainsi engagé à développer d'ici 2030 une capacité installée de trois gigawatts d'électrolyse."
24,Air Liquide : soudaine envolée à la clôture et record absolu,2023-06-16 19:42:00,"Air Liquide a bénéficié d'une soudaine envolée de +4,7% à la clôture (partant de 164E, l'ex-zénith du 2 mai), ce qui a propulsé le cours vers un record absolu de 167,94E. Le titre pulvérise au passage une résistance oblique long terme issue des sommets de mi-février 2020 (127E) et de début juin 2022 (153E): il n'y a plus d'obstacle technique dans la mesure ou le doublement de valeur par rapport au plancher des 86,25E du 16 mars 2020 est dépassé."
25,Air Liquide: lance Hydrogen Airport avec ADP,2023-06-16 09:20:00,"Air Liquide et Groupe ADP annoncent la création de Hydrogen Airport, la première coentreprise d'ingénierie et de conseil spécialisée dans l'accompagnement des aéroports pour leurs projets d'intégration de l'hydrogène dans leurs infrastructures. Cette coentreprise s'inscrit dans le prolongement d'un travail d'études mené conjointement avec Airbus en 2021 et portant sur des études de faisabilité pour accompagner l'arrivée des avions à hydrogène dans une trentaine d'aéroports dans le monde. Ce partenariat traduit l'ambition commune des deux Groupes de préparer, dès aujourd'hui, le déploiement d'une aviation mondiale décarbonée. Dans le cadre de cette coentreprise, Air Liquide apporte son expertise dans le domaine de l'hydrogène, allant de la production d'hydrogène renouvelable ou bas carbone, la liquéfaction, le stockage jusqu'à la distribution de l'hydrogène pour les avions. Groupe ADP apporte son expertise en matière d'aménagements et d'opérations aéroportuaires."
26,Air Liquide: des évolutions au sein de son comité exécutif,2023-06-07 09:42:00,"A compter du 1erseptembre, sous la conduite de François Jackow, directeur général, le Comité exécutif d'Air Liquide s'établira comme suit : François Abrial, est nommé Secrétaire général du Groupe. Il supervisera le contrôle général et conformité, la direction juridique Groupe, les affaires publiques et internationales, ainsi que le Digital & IT. Ronnie Chalmers est nommé directeur du Pôle Asie Pacifique. Matthieu Giard, est nommé directeur du Pôle Amériques. Armelle Levieux est nommée directrice de l'Innovation. Elle supervisera également les Branches d'Activités Mondiales Hydrogène Energie et Électronique. Emilie Mouren-Renouard est nommée directrice du Pôle Europe Industries. Pascal Vinet est nommé directeur général adjoint. Il supervisera également la Branche d'Activité Mondiale Industriel. Enfin, la direction des Ressources Humaines du Groupe sera annoncée ultérieurement. 'Cette nouvelle organisation nous permettra de continuer notre trajectoire de performance et de croissance, et ainsi de préparer l'avenir en bénéficiant de toute l'expertise et l'expérience d'une équipe solide, engagée, aux compétences complémentaires ', commente François Jackow."
