,title,date,content
349,Air Liquide: Morgan Stanley vise maintenant 124 euros,2019-04-10 11:51:00,"Dans le cadre d'une note sectorielle consacrée aux valeurs de la chimie au sens large, Morgan Stanley a confirmé son conseil d'achat ('surpondérer') sur l'action Air Liquide. A la suite de l'ajustement des prévisions, l'objectif de cours est porté de 118 à 124 euros. Le géant français des gaz industriels et médicaux publiera son chiffre d'affaires trimestriel le 26 avril prochain. Globalement, le premier trimestre s'annonce difficile pour le secteur dans un contexte d'activité réduite, notamment dans l'automobile, et alors que la météo n'était pas favorable. En Bourse, il a pourtant connu un 're-rating' (une réappréciation) autant contre les valeurs cycliques que les défensives, et la prime qu'il présente relativement à l'indice MSCI Europe atteint des niveaux perdus de vue en 2015 et 2016. Attention, la conjoncture actuelle permet difficilement d'envisager de nouvelles révisions à la hausse des anticipations à l'échelle du secteur. Dans le cas d'Air Liquide, Morgan Stanley attend avec confiance les ventes trimestrielles, les tendances observées au 4e trimestre et ensuite étant jugées rassurantes. Malgré une base de comparaison difficile, la croissance organique de la branche Gaz & Services devrait atteindre 4,6%, anticipent les analystes. A suivre : les commandes et les commentaires de la direction sur les marges. UBS est aussi à l'achat sur Covestro, Evonik et Croda, entre autres. 'Pour l'investisseur à plus long terme, nous sommes d'avis que la croissance d'Air Liquide et de Johnson Matthey reste convaincante', indique une note de recherche."
350,Air Liquide: a marqué un nouveau record historique,2019-04-04 16:15:00,
351,Air Liquide: l'avis d'un analyste avant le CA trimestriel,2019-04-03 18:13:00,"Le titre termine en hausse de 1,3% profitant de l'analyse positive d'UBS. Le bureau d'analyse confirme son conseil d'achat sur l'action. Les analystes se montrent confiants avant les ventes trimestrielles que le géant français des gaz industriels et médicaux présentera le 26 avril. L'objectif de cours à 12 mois est maintenu à 120 euros. Les analystes reviennent sur les indicateurs avancés que le groupe vient de publier en vue du point trimestriel. Ils en retiennent principalement l'effet calendaire négatif qui caractérise la période. Cela étant, 'la croissance organique de la branche Gaz & Services devrait rester solide au 1er trimestre 2019', estime UBS qui l'attend à 6,4% grâce à la subdivision Grande industrie, aux mises en service de nouveaux sites (notamment en Chine), et à une base de comparaison plus favorable. Et ce alors que le carnet de commande demeure bien rempli. 'Le secteur a déjà connu une inflexion en 2018, mais nous nous attendons à ce que la croissance organique des ventes de gaz atteigne au moins 5% en 2019 et en 2020, contrastant ainsi avec la faible tendance de la période 2012-2017', lorsque la croissance annuelle moyenne des quatre grands noms du gaz s'était limitée à 2,9%, termine UBS."
352,Air Liquide: UBS optimiste avant le CA trimestriel,2019-04-03 11:02:00,"UBS confirme ce matin son conseil d'achat sur l'action Air Liquide, qui se traite à moins de 50 centimes de son sommet historique. Les analystes se montrent confiants avant les ventes trimestrielles que le géant français des gaz industriels et médicaux présentera le 26 avril. L'objectif de cours à 12 mois est maintenu à 120 euros. Les analystes reviennent sur les indicateurs avancés que le groupe vient de publier en vue du point trimestriel. Ils en retiennent principalement l'effet calendaire négatif qui caractérise la période. Cela étant, 'la croissance organique de la branche Gaz & Services devrait rester solide au 1er trimestre 2019', estime UBS qui l'attend à 6,4% grâce à la subdivision Grande industrie, aux mises en service de nouveaux sites (notamment en Chine), et à une base de comparaison plus favorable. Et ce alors que le carnet de commande demeure bien rempli. 'Le secteur a déjà connu une inflexion en 2018, mais nous nous attendons à ce que la croissance organique des ventes de gaz atteigne au moins 5% en 2019 et en 2020, contrastant ainsi avec la faible tendance de la période 2012-2017', lorsque la croissance annuelle moyenne des quatre grands noms du gaz s'était limitée à 2,9%, termine UBS."
353,Air Liquide: inauguration d'un Campus Innovation au Japon,2019-03-28 09:53:00,"Air Liquide annonce l'inauguration de son Campus Innovation Tokyo à Yokosuka, au Japon, dans un nouveau site à la pointe de la technologie de 8.000 mètres carrés, comprenant huit laboratoires et six plateformes pilotes. Ce Campus, qui représente un investissement de 50 millions d'euros, réunira près de 200 collaborateurs : chercheurs, spécialistes du digital, experts des applications client, ainsi que des équipes dédiées à l'exploration de nouveaux marchés. Il sera en grande partie dédié au développement de matériaux avancés, et aura vocation à accélérer le développement de solutions visant à améliorer l'efficacité énergétique, à réduire l'empreinte carbone, et à développer de nouvelles énergies."
354,"Air Liquide: repli enrayé vers 110,5E -Air Liquide",2019-03-25 18:27:00,"Air Liquide se redresse vers 112,1E: le titre a enrayé son repli vers 110,5E mais la dynamique haussière n'est pas restaurée. Le titre pourraient rechuter ultérieurement en direction du 'gap' des 108,85E du 25/02."
355,Air Liquide: nouveau contrat à long terme avec Severstal,2019-03-22 09:31:00,"Air Liquide annonce avoir signé avec le groupe sidérurgique et minier russe Severstal, un nouveau contrat à long terme portant sur la fourniture d'oxygène, d'azote et d'argon à Tcherepovets, dans la partie européenne de la Russie. Le groupe français investira environ 50 millions d'euros dans la construction d'une unité de séparation des gaz de l'air (ASU) à la pointe de la technologie, qui améliorera l'efficacité énergétique et l'empreinte environnementale globale du site de Severstal. La capacité de production totale d'Air Liquide sur ce site sera ainsi portée à plus de 7.000 tonnes d'oxygène par jour, faisant de Tcherepovets l'une des plus grande unités de production de gaz industriel de l'industrie sidérurgique dans le monde."
356,Air Liquide: BlackRock passe sous les 5% -Air Liquide,2019-03-21 10:11:00,"BlackRock, agissant pour le compte de clients et de fonds dont elle assure la gestion, a déclaré à l'AMF avoir franchi en baisse, le 19 mars, les seuils de 5% du capital et des droits de vote d'Air Liquide et détenir 4,95% du capital et des droits de vote. Ce franchissement de seuils résulte d'une cession d'actions Air Liquide hors et sur le marché et d'une restitution d'actions détenues à titre de collatéral."
357,Air Liquide: acquisition de Tech Air finalisée,2019-03-21 07:15:00,"Air Liquide annonce la finalisation par sa filiale américaine Airgas de l'acquisition de Tech Air, un important distributeur indépendant de gaz industriels et de fournitures de soudage des Etats-Unis desservant plusieurs zones géographiques du pays. 'Cette transaction permet à Airgas de continuer à renforcer son réseau aux États-Unis avec une présence complémentaire afin de mieux servir ses clients tout en générant des gains d'efficacité significatifs', explique le groupe français de gaz industriels. Au service de plus de 45.000 clients, Tech Air compte environ 550 collaborateurs et génère environ 190 millions de dollars de chiffre d'affaires annuel. Il exploite 50 sites en Californie, au Texas, ainsi que dans le nord-est et le sud-est des États-Unis."
358,Air Liquide: BlackRock détient moins d'actions,2019-03-20 18:40:00,"Un avis publié hier par l'Autorité des marchés financiers relaie la déclaration selon laquelle le 15 mars, la méga-gestion américaine BlackRock a franchi en baisse les seuils de 5% du capital et des droits de vote d'Air Liquide. A cette date, pour le compte de ses fonds et de ses clients, et après la cession de titres hors marché et une restitution d'actions détenues à titre de collatéral, BlackRock pointait à 4,98% des parts et des voix du géant français des gaz industriels et médicaux."
359,Air Liquide: BlackRock réduit la ligne -Air Liquide,2019-03-20 11:36:00,"Un avis publié hier par l'Autorité des marchés financiers relaie la déclaration selon laquelle le 15 mars, la méga-gestion américaine BlackRock a franchi en baisse les seuils de 5% du capital et des droits de vote d'Air Liquide. A cette date, pour le compte de ses fonds et de ses clients, et après la cession de titres hors marché et une restitution d'actions détenues à titre de collatéral, BlackRock pointait à 4,98% des parts et des voix du géant français des gaz industriels et médicaux."
360,Air Liquide: Airgas a finalisé l'acquisition de Tech Air,2019-03-19 18:03:00,"Air Liquide annonce la finalisation par Airgas de l'acquisition de Tech Air. Il s'agit d'un important distributeur indépendant de gaz industriels et de fournitures de soudage des Etats-Unis desservant plusieurs zones géographiques du pays. Airgas va renforcer ainsi son réseau de distribution permettant une plus grande proximité avec les clients locaux. Au service de plus de 45 000 clients, l'entreprise, qui compte environ 550 collaborateurs, génère environ 190 millions de dollars US de chiffre d'affaires annuel. ' Cette transaction permet à Airgas de continuer à renforcer son réseau aux États-Unis avec une présence complémentaire afin de mieux servir ses clients tout en générant des gains d'efficacité significatifs ' indique le groupe."
361,Air Liquide: BlackRock a allégé sa participation,2019-03-19 12:30:00,"Un avis publié ce matin par l'Autorité des marchés financiers relaie la déclaration selon laquelle le 15 mars, la méga-gestion américaine BlackRock a franchi en baisse les seuils de 5% du capital et des droits de vote d'Air Liquide. A cette date, pour le compte de ses fonds et de ses clients, et après la cession de titres hors marché et une restitution d'actions détenues à titre de collatéral, BlackRock pointait à 4,98% des parts et des voix du géant français des gaz industriels et médicaux."
362,Air Liquide: BlackRock est monté dans le capital,2019-03-18 11:48:00,"La société BlackRock, Inc. agissant pour le compte de clients et de fonds dont elle assure la gestion, a déclaré avoir franchi en hausse, le 14 mars 2019, les seuils de 5% du capital et des droits de vote de la société l'Air Liquide et détenir, pour le compte desdits clients et fonds, 21 473 082 actions l'Air Liquide représentant autant de droits de vote, soit 5,00001% du capital et des droits de vote de cette société. Ce franchissement de seuils résulte d'une réception d'actions l'Air Liquide détenues à titre de collatéral."
363,Air Liquide: BlackRock a allégé sa participation,2019-03-15 13:00:00,"Un avis publié ce matin par l'Autorité des marchés financiers relaie la déclaration selon laquelle le 13 mars, la méga-gestion américaine BlackRock a franchi en baisse les seuils de 5% du capital et des droits de vote d'Air Liquide. A cette date, pour le compte de ses fonds et de ses clients, et après la cession de titres hors marché et une restitution d'actions détenues à titre de collatéral, BlackRock pointait à 4,98% des parts et des voix du géant français des gaz industriels et médicaux."
364,Air Liquide: BlackRock est monté dans le capital,2019-03-13 11:02:00,"La société BlackRock, Inc. agissant pour le compte de clients et de fonds dont elle assure la gestion, a déclaré avoir franchi en hausse, le 11 mars 2019, les seuils de 5% du capital et des droits de vote de la société L'Air Liquide et détenir, pour le compte desdits clients et fonds, 21 506 700 actions L'Air Liquide représentant autant de droits de vote, soit 5,01% du capital et des droits de vote de cette société. Ce franchissement de seuils résulte d'une réception d'actions L'Air Liquide détenues à titre de collatéral."
365,Air Liquide: BlackRock détient moins de droits de vote,2019-03-07 13:26:00,"La société BlackRock, Inc. agissant pour le compte de clients et de fonds dont elle assure la gestion, a déclaré avoir franchi en baisse, le 5 mars 2019, les seuils de 5% du capital et des droits de vote de la société Air Liquide et détenir, pour le compte desdits clients et fonds, 21 285 374 actions Air Liquide représentant autant de droits de vote, soit 4,96% du capital et des droits de vote de cette société. Ce franchissement de seuils résulte d'une cession d'actions Air Liquide hors et sur le marché et d'une restitution d'actions Air Liquide détenues à titre de collatéral."
366,Air Liquide: BlackRock repasse au-dessus de 5%,2019-03-06 12:35:00,"BlackRock, agissant pour le compte de clients et de fonds dont elle assure la gestion, a déclaré à l'AMF avoir franchi en hausse, le 4 mars, les seuils de 5% du capital et des droits de vote d'Air Liquide. Elle détient, pour le compte desdits clients et fonds, 21.659.229 actions Air Liquide représentant autant de droits de vote, soit 5,04% du capital et des droits de vote. 'Ce franchissement de seuils résulte d'une réception d'actions Air Liquide détenues à titre de collatéral', indique l'AMF."
367,Air Liquide: obtention de labels Solar Impulse,2019-03-05 18:09:00,"Le groupe Air Liquide annonce s'être vu décerné quatre labels 'Efficient Solution', décernés par la fondation Solar Impulse, dont trois pour des solutions développées par Air Liquide et une par un spin-off du groupe. Ainsi, ce sont les offres Nexelia (fusion du métal), Eco Chiller (éco-refroidisseur), de récupération d'énergie grâce à la cryogénie et Wagabox qui ont été distinguées."
368,Air Liquide: BlackRock s'allège au capital,2019-03-01 14:07:00,"BlackRock, agissant pour le compte de clients et de fonds dont elle assure la gestion, a déclaré à l'AMF avoir franchi en baisse, le 27 février, les seuils de 5% du capital et des droits de vote d'Air Liquide et détenir 4,98% du capital et des droits de vote. Ce franchissement de seuils résulte d'une cession d'actions Air Liquide sur le marché et d'une restitution d'actions détenues à titre de collatéral."
369,Air Liquide: BlackRock au-dessus de 5% du capital,2019-02-27 12:07:00,"BlackRock, agissant pour le compte de clients et de fonds dont elle assure la gestion, a déclaré à l'AMF avoir franchi en hausse, le 25 février, les seuils de 5% du capital et des droits de vote d'Air Liquide. Elle a ainsi précisé détenir, pour le compte desdits clients et fonds, 21.666.668 actions Air Liquide représentant autant de droits de vote, soit 5,05% du capital et des droits de vote. 'Ce franchissement de seuils résulte d'une acquisition d'actions Air Liquide sur le marché et d'une réception d'actions détenues à titre de collatéral', précise l'AMF."
370,Air Liquide: BlackRock passe sous les 5% -Air Liquide,2019-02-25 12:57:00,"BlackRock, agissant pour le compte de clients et de fonds dont elle assure la gestion, a déclaré à l'AMF avoir franchi en baisse, le 21 février, les seuils de 5% du capital et des droits de vote d'Air Liquide. BlackRock détient ainsi, pour le compte desdits clients et fonds, 21.216.603 actions Air Liquide représentant autant de droits de vote, soit 4,94% du capital et des droits de vote. 'Ce franchissement de seuils résulte d'une cession d'actions Air Liquide sur le marché et d'une restitution d'actions détenues à titre de collatéral', indique l'AMF."
371,Air Liquide: ouvre le plus grand électrolyseur PEM au Canada,2019-02-25 09:53:00,"Air Liquide annonce la construction au Canada du plus grand électrolyseur PEM (Membrane Échangeuse de Protons) au monde. Il sera d'une capacité de 20 mégawatts (MW) et permettra la production d'hydrogène décarboné. Air Liquide installera un électrolyseur de 20 MW, augmentant ainsi de 50 % la capacité actuelle de son site de production d'hydrogène située à Bécancour, dans la région de Québec, au Canada. ' La proximité de Bécancour avec les principaux marchés industriels au Canada et aux États-Unis contribuera à assurer l'approvisionnement en hydrogène bas carbone de l'Amérique du Nord, que ce soit pour des usages de l'industrie ou la mobilité ' indique le groupe. ' Ces investissements sont en ligne avec les objectifs climat du Groupe visant à réduire l'intensité carbone de ses activités, agir avec ses clients pour une industrie durable et favoriser l'émergence d'une société bas carbone. ' a déclaré Michael J. Graff, Directeur Général Adjoint et Directeur de Air Liquide S. A., Président et Chef de la direction d'American Air Liquide Holdings, Inc."
372,Air Liquide: BlackRock a renforcé sa participation,2019-02-19 13:02:00,"Un avis publié ce matin par l'Autorité des marchés financiers relaie la déclaration selon laquelle le 15 février, la méga-gestion américaine BlackRock a franchi en hausse les seuils de 5% du capital et des droits de vote d'Air Liquide. A cette date, pour le compte de ses fonds et de ses clients, et après l'achat de titres hors marché et la réception d'actions détenues à titre de collatéral, BlackRock pointait à 5,01% des parts et des voix du géant français des gaz industriels et médicaux."
373,Air Liquide: Liberum reste à 'achat' après les résultats,2019-02-14 12:00:00,"Liberum réaffirme sa recommandation 'achat' et son objectif de cours de 126 euros sur Air Liquide, après la publication des résultats annuels du géant français des gaz industriels, d'où ressort la croissance rapide de son activité de gaz électroniques. Le broker souligne que celle-ci a réalisé une croissance organique impressionnante à chaque trimestre en 2018 (+10% en données comparables sur l'année), soutenue par une progression structurelle dans son activité de matériaux avancés. 'L'électronique ne représente que 9% des revenus de gaz aujourd'hui et probablement 10-12% des profits, mais est un actif sous-apprécié avec des retours supérieurs à la moyenne et le potentiel de maintenir une croissance deux fois la moyenne du groupe', poursuit-il. Air Liquide's Electronic Gases business enjoyed impressive organic growth in 2018 in every quarter (+10% LFL for year) buoyed by a structural growth story in its advanced materials business where the materials intensity of semiconductor and display manufacturing is increasing. In 4Q18 the growth was particularly eye-catching at +17% yoy as progress in Advanced Materials combined with a 50% increase in sales in the lumpy Equipment and Installation business and the ramp up of carrier gases units in Singapore, Taiwaan, China and Japan. Electronics is only 9% of Gases revenues today and probably 10-12% of profits but is an underappreciated asset with above average returns and the potential to sustain growth 2x the group average. For those interested in learning more refer to our deep dive shown below "
374,"Air Liquide: croissance de 4,2% du résultat net annuel",2019-02-14 08:15:00,"Air Liquide affiche un résultat net part du groupe en progression de 4,2% à 2.113 millions d'euros en 2018, et une marge opérationnelle (ROC sur chiffre d'affaires) de 16,4% au total et 16,6% hors effet énergie, en amélioration de 10 points de base. A 21.011 millions d'euros, le chiffre d'affaires du groupe de gaz industriels ressort en hausse publiée de 3,3% et comparable de 6,1%, supérieure à la borne haute de l'objectif NEOS. Il est soutenu par une croissance des ventes gaz et services élevée (+5,2%). Air Liquide proposera un dividende stable à 2,65 euros par action, ainsi que l'attribution d'une action gratuite pour 10 actions détenues. Il se dit 'confiant dans sa capacité à réaliser en 2019 une croissance du résultat net, calculée à change constant'."
375,Air Liquide: réalise l'acquisition de TA Corporate Holdings,2019-02-06 18:00:00,"Air Liquide annonce l'acquisition par Airgas de TA Corporate Holdings, Inc. Cette société est un important distributeur indépendant de gaz industriels et de fournitures de soudage des Etats-Unis desservant plusieurs zones géographiques du pays. L'entreprise qui compte environ 550 collaborateurs, a généré environ 190 millions de dollars US en 2018. Tech Air exploite 50 sites en Californie, au Texas, ainsi que dans le nord-est et le sud-est des États-Unis. La société compte plus de 45 000 clients. ' Avec cette acquisition, Airgas pourra continuer à renforcer son réseau de distribution permettant une plus grande proximité avec les clients locaux ' indique le groupe."
376,Air Liquide: deux acquisitions dans la santé en Suisse,2019-02-05 09:15:00,"Air Liquide, le géant français des gaz industriels et médicaux, annonce ce matin l'acquisition de deux sociétés suisses qui étofferont son activité de santé à domicile : Sleep & Health et Megamed. Les conditions financières des opérations n'ont pas été précisées. Megamed est 'présente depuis près de 50 ans sur le marché suisse' quand Sleep & Health, fondée en 2003, est présentée comme 'un acteur national qui accompagne les patients souffrant d'apnée du sommeil'. Concurrent entre autres de l'allemand Linde, Air Liquide revendique le rang de numéro un européen de la santé à domicile."
377,Air Liquide: prend une participation dans Hydrogenics,2019-01-24 18:11:00,"Air Liquide annonce une prise de participation de 18,6 % dans le capital de la société canadienne Hydrogenics Corporation. Cette société est spécialisée des les équipements de production d'hydrogène par électrolyse et des piles à combustible. Cette opération correspond à un investissement de 20,5 millions de dollars américains (18 millions d'euros). ' Elle permet au Groupe de réaffirmer son engagement à long terme dans les marchés de l'hydrogène énergie et son ambition d'être un acteur majeur dans la fourniture d'hydrogène décarboné ' indique la direction. Air Liquide et Hydrogenics ont également conclu un accord technologique et commercial afin de développer conjointement des technologies d'électrolyse PEM (Proton Exchange Membrane). François Darchis, Directeur de la Société et membre du Comité Exécutif d'Air Liquide a déclaré:  L'électrolyse de l'eau est une des technologies clefs pour accélérer l'émergence de l'hydrogène comme vecteur d'énergie durable. En effet, elle permet de produire de l'hydrogène totalement décarboné, grâce notamment à l'électricité renouvelable. Nous sommes plus que jamais convaincus que l'hydrogène jouera un rôle majeur dans la lutte contre le réchauffement climatique ."
378,Air Liquide: BlackRock a allégé sa participation,2019-01-22 12:02:00,"Un avis publié ce matin par l'Autorité des marchés financiers relaie la déclaration selon laquelle le 18 janvier, la méga-gestion américaine BlackRock a franchi en baisse les seuils de 5% du capital et des droits de vote d'Air Liquide. A cette date, pour le compte de ses fonds et de ses clients, et après la cession de titres sur le marché et une restitution d'actions détenues à titre de collatéral, BlackRock pointait à 4,90% des parts et des voix du géant français des gaz industriels et médicaux."
379,Air Liquide: BlackRock au-dessus des 5% du capital,2019-01-21 12:23:00,"La société BlackRock, agissant pour le compte de clients et de fonds dont elle assure la gestion, a déclaré à l'AMF avoir franchi en hausse, le 17 janvier, les seuils de 5% du capital et des droits de vote d'Air Liquide. Elle détient ainsi, pour le compte desdits clients et fonds, 21.530.570 actions Air Liquide, représentant autant de droits de vote, soit 5,01% du capital et des droits de vote de cette société. 'Ce franchissement de seuils résulte d'une acquisition d'actions Air Liquide hors marché et d'une réception d'actions détenues à titre de collatéral', précise l'AMF."
380,Air Liquide: UBS parie sur la croissance et passe à l'achat,2018-12-06 11:22:00,"UBS est passé à l'achat sur l'action du spécialiste français des gaz industriels et médicaux Air Liquide ce matin. L'objectif de cours est relevé de 109 à 117 euros. Parallèlement, UBS a aussi entamé à l'achat le suivi de l'action du concurrent allemand Linde, avec une cible de 165 euros. Les analystes ont passé en revue le secteur de la chimie au sens large, qui en 2019 devrait connaître sa croissance la plus faible depuis 2015. De plus, les prix des matières premières menaceraient les marges alors que les valorisations des actions sont jugées plutôt élevées. Bref, UBS abaisse ses prévisions de bénéfices par action pour le secteur de 5% en 2019, ce qui ne présage plus que d'une hausse de 4% par rapport à 2018, alors que le consensus attend + 7%. Dans ce contexte, UBS entend 'rester défensif' et distingue Air Liquide. La note se montre positive sur la Grande industrie, deuxième grande branche d'activité du groupe français après l'Industriel marchand : dans cette division, la croissance devrait accélérer en 2019 et 2020 en lien avec les investissements prévus par les clients des secteurs pétro-gaziers et de la chimie. Bref, 'nous estimons que la croissance organique des Gaz & services d'Air Liquide sera nettement supérieure à celle du PIB mondial en 2018, une première depuis 2011', indique UBS."
381,Air Liquide: renoue avec les 106E -Air Liquide,2018-11-30 14:00:00,
