date,content,cleaned_article_stemming,cleaned_article_lemmatization
2022-05-02,"Air Liquide a annoncé lundi la signature d'une alliance stratégique avec Lotte Chemical en vue de déployer une chaîne d'approvisionnement dédiée à l'hydrogène en Corée du Sud. Les deux partenaires ont prévu de créer une co-entreprise, qui sera contrôlée à hauteur de 60% par le groupe français, en vue d'investir dans deux centres de conditionnement de l'hydrogène de grande taille basés à Daesan et Ulsa. Ce positionnement au cour des bassins industriels du pays permettra de desservir les zones densément peuplées de la métropole de Séoul et de la province de Gyeonggi dans le nord-ouest. Ils alimenteront aussi les régions métropolitaines d'Ulsan/Daegu/Busan et les provinces de Gyeongsang dans le sud-est. Air Liquide Korea et Lotte disent anticiper des synergies 'importantes' contribuant à l'émergence d'une économie hydrogène en Corée, où la demande en hydrogène destiné à la mobilité devrait atteindre 100 tonnes par jour d'ici à 2025, et plus de 1.000 tonnes par jour d'ici 2030.","['a', 'annonc', 'lund', 'signatur', 'allianc', 'strateg', 'lott', 'chemical', 'vu', 'déploi', 'chaîn', 'dédi', 'cor', 'sud', 'le', 'deux', 'partenair', 'prévu', 'cré', 'contrôl', 'hauteur', 'group', 'franc', 'vu', 'deux', 'centr', 'condition', 'grand', 'taill', 'bas', 'daesan', 'ulsa', 'ce', 'position', 'cour', 'bassin', 'industriel', 'pay', 'permettr', 'desserv', 'zon', 'dens', 'peupl', 'métropol', 'séoul', 'provinc', 'gyeongg', 'il', 'aliment', 'auss', 'région', 'métropolitain', 'provinc', 'gyeongsang', 'kor', 'lott', 'disent', 'anticip', 'synerg', 'contribu', 'économ', 'hydrogen', 'cor', 'où', 'demand', 'hydrogen', 'destin', 'mobil', 'devr', 'atteindr', 'ton', 'jour', 'plus', 'ton', 'jour']","['Air', 'Liquide', 'a', 'annoncé', 'lundi', 'signature', 'alliance', 'stratégique', 'Lotte', 'Chemical', 'vue', 'déployer', 'chaîne', 'dédiée', 'Corée', 'Sud', 'Les', 'deux', 'partenaires', 'prévu', 'créer', 'contrôlée', 'hauteur', 'groupe', 'français', 'vue', 'deux', 'centre', 'conditionnement', 'grande', 'taille', 'basés', 'Daesan', 'Ulsa', 'Ce', 'positionnement', 'cour', 'bassins', 'industriels', 'pay', 'permettra', 'desservir', 'zone', 'densément', 'peuplées', 'métropole', 'Séoul', 'province', 'Gyeonggi', 'Ils', 'alimenteront', 'aussi', 'régions', 'métropolitaines', 'province', 'Gyeongsang', 'Air', 'Liquide', 'Korea', 'Lotte', 'disent', 'anticiper', 'synergy', 'contribuant', 'économie', 'hydrogène', 'Corée', 'où', 'demande', 'hydrogène', 'destiné', 'mobilité', 'devrait', 'atteindre', 'tonne', 'jour', 'plus', 'tonne', 'jour']"
2022-04-28,"Bank of America a annoncé jeudi avoir ajouté le titre Air Liquide à sa liste 'Europe 1' de valeurs recommandées en raison du rôle potentiel que pourrait jouer le groupe dans la transition énergétique. A en croire BofA, cette thématique est susceptible de générer une accélération sur plusieurs années de la croissance de la société, un scénario que l'intermédiaire juge pour l'instant 'sous-estimé' par le marché. L'analyste estime, en outre, que les résultats de premier trimestre ont confirmé la solide maîtrise des prix ('pricing power') dont bénéficie le spécialiste des gaz industriel en vue de faire face à l'inflation, ainsi que sa croissance rapide dans le domaine des applications électroniques. BofA maintient une recommandation d'achat sur le titre, assortie d'un objectif de cours de 200 euros faisant apparaitre un potentiel proche de 25%.","['bank', 'of', 'americ', 'a', 'annonc', 'jeud', 'avoir', 'ajout', 'titr', 'list', 'valeur', 'recommand', 'raison', 'rôl', 'potentiel', 'pourr', 'jou', 'group', 'transit', 'énerget', 'a', 'croir', 'bof', 'cet', 'thémat', 'susceptibl', 'géner', 'accéler', 'plusieur', 'anné', 'croissanc', 'societ', 'scénario', 'jug', 'march', 'estim', 'outr', 'résultat', 'premi', 'trimestr', 'confirm', 'solid', 'maîtris', 'prix', 'pow', 'dont', 'bénéfic', 'spécial', 'gaz', 'industriel', 'vu', 'fair', 'fac', 'ains', 'croissanc', 'rapid', 'domain', 'appliqu', 'électron', 'bof', 'maintient', 'recommand', 'titr', 'assort', 'object', 'cour', 'euros', 'fais', 'apparaitr', 'potentiel', 'proch']","['Bank', 'of', 'America', 'a', 'annoncé', 'jeudi', 'avoir', 'ajouté', 'titre', 'Air', 'Liquide', 'liste', 'valeurs', 'recommandées', 'raison', 'rôle', 'potentiel', 'pourrait', 'jouer', 'groupe', 'transition', 'énergétique', 'A', 'croire', 'BofA', 'cette', 'thématique', 'susceptible', 'générer', 'accélération', 'plusieurs', 'années', 'croissance', 'société', 'scénario', 'juge', 'marché', 'estime', 'outre', 'résultats', 'premier', 'trimestre', 'confirmé', 'solide', 'maîtrise', 'prix', 'power', 'dont', 'bénéficie', 'spécialiste', 'gaz', 'industriel', 'vue', 'faire', 'face', 'ainsi', 'croissance', 'rapide', 'domaine', 'application', 'électroniques', 'BofA', 'maintient', 'recommandation', 'titre', 'assortie', 'objectif', 'cours', 'euro', 'faisant', 'apparaitre', 'potentiel', 'proche']"
2022-04-28,"Air Liquide a annoncé hier soir avoir conclu un contrat de long terme avec l'aciériste Ezz Steel portant sur la fourniture de gaz industriels pour une nouvelle usine située à l'est du Caire, en Egypte. Le groupe français explique qu'il prévoit d'investir environ 80 millions de dollars dans la construction d'une unité de séparation des gaz de l'air (ASU) destinée à répondre aux besoins d'Ezz, mais aussi à ceux d'autres clients présents sur ce bassin industriel. Le projet, d'une capacité de production d'oxygène de 770 tonnes par jour, doit s'accompagner d'une extension du réseau de canalisations d'Air Liquide afin de relier la future usine aux quatre unités de séparation des gaz de l'air que le groupe exploite déjà dans la région. En ligne avec l'objectif de neutralité carbone d'Air Liquide à horizon 2050, le projet doit intégrer une feuille de route prévoyant approvisionnement en énergie renouvelable pour réduire les émissions de CO2.","['a', 'annonc', 'hi', 'soir', 'avoir', 'conclu', 'contrat', 'long', 'term', 'ezz', 'steel', 'port', 'fournitur', 'gaz', 'industriel', 'nouvel', 'usin', 'situ', 'cair', 'egypt', 'le', 'group', 'franc', 'expliqu', 'prévoit', 'environ', 'million', 'dollar', 'construct', 'unit', 'sépar', 'gaz', 'asu', 'destin', 'répondr', 'besoin', 'auss', 'ceux', 'client', 'présent', 'bassin', 'industriel', 'le', 'projet', 'capac', 'product', 'ton', 'jour', 'doit', 'extens', 'réseau', 'canalis', 'afin', 'reli', 'futur', 'usin', 'quatr', 'unit', 'sépar', 'gaz', 'group', 'exploit', 'déjà', 'région', 'en', 'lign', 'neutral', 'carbon', 'horizon', 'projet', 'doit', 'integr', 'feuill', 'rout', 'prévoi', 'approvision', 'énerg', 'renouvel', 'réduir', 'émiss']","['Air', 'Liquide', 'a', 'annoncé', 'hier', 'soir', 'avoir', 'conclu', 'contrat', 'long', 'terme', 'Ezz', 'Steel', 'portant', 'fourniture', 'gaz', 'industriels', 'nouvelle', 'usine', 'située', 'Caire', 'Egypte', 'Le', 'groupe', 'français', 'explique', 'prévoit', 'environ', 'million', 'dollar', 'construction', 'unité', 'séparation', 'gaz', 'ASU', 'destinée', 'répondre', 'besoins', 'aussi', 'ceux', 'client', 'présents', 'bassin', 'industriel', 'Le', 'projet', 'capacité', 'production', 'tonne', 'jour', 'doit', 'extension', 'réseau', 'canalisation', 'Liquide', 'afin', 'relier', 'future', 'usine', 'quatre', 'unités', 'séparation', 'gaz', 'groupe', 'exploite', 'déjà', 'région', 'En', 'ligne', 'neutralité', 'carbone', 'Liquide', 'horizon', 'projet', 'doit', 'intégrer', 'feuille', 'route', 'prévoyant', 'approvisionnement', 'énergie', 'renouvelable', 'réduire', 'émissions']"
2022-04-27,"Le chiffre d'affaires du Groupe atteint 6 887 millions d'euros au 1er trimestre 2022, en croissance de + 7,9 % en données comparables (+ 29 % en publié). ' Cette performance s'établit dans un environnement difficile de prix de l'énergie exceptionnellement élevés, de forte inflation, de tension dans les chaînes d'approvisionnement et de conflit en Ukraine ' indique le groupe. Le chiffre d'affaires Gaz & Services atteint 6 590 millions d'euros, en hausse de + 7,1 % en données comparables. Les ventes publiées du 1er trimestre 2022 sont en croissance de + 29,1 %. Les décisions d'investissement du trimestre sont très élevées à 913 millions d'euros, avec plusieurs projets dans l'Électronique, notamment en Asie. ' En 2022, en l'absence de perturbation significative de l'économie, Air Liquide est confiant dans sa capacité à augmenter à nouveau sa marge opérationnelle et à réaliser une croissance du résultat net récurrent, à change constant ' rejoute le groupe.","['le', 'chiffr', 'group', 'atteint', 'million', 'trimestr', 'croissanc', 'don', 'compar', 'publi', 'cet', 'perform', 'environ', 'difficil', 'prix', 'exceptionnel', 'élev', 'fort', 'inflat', 'tension', 'chaîn', 'confl', 'ukrain', 'indiqu', 'group', 'le', 'chiffr', 'gaz', 'servic', 'atteint', 'million', 'hauss', 'don', 'compar', 'le', 'vent', 'publi', 'trimestr', 'croissanc', 'le', 'décis', 'trimestr', 'tres', 'élev', 'million', 'plusieur', 'projet', 'not', 'asi', 'en', 'perturb', 'signif', 'confi', 'capac', 'augment', 'nouveau', 'marg', 'opérationnel', 'réalis', 'croissanc', 'résultat', 'net', 'récurrent', 'chang', 'const', 'rejout', 'group']","['Le', 'chiffre', 'Groupe', 'atteint', 'million', 'trimestre', 'croissance', 'données', 'comparables', 'publié', 'Cette', 'performance', 'environnement', 'difficile', 'prix', 'exceptionnellement', 'élevés', 'forte', 'inflation', 'tension', 'chaînes', 'conflit', 'Ukraine', 'indique', 'groupe', 'Le', 'chiffre', 'Gaz', 'Services', 'atteint', 'million', 'hausse', 'données', 'comparables', 'Les', 'ventes', 'publiées', 'trimestre', 'croissance', 'Les', 'décisions', 'trimestre', 'très', 'élevées', 'million', 'plusieurs', 'projets', 'notamment', 'Asie', 'En', 'perturbation', 'significative', 'Air', 'Liquide', 'confiant', 'capacité', 'augmenter', 'nouveau', 'marge', 'opérationnelle', 'réaliser', 'croissance', 'résultat', 'net', 'récurrent', 'change', 'constant', 'rejoute', 'groupe']"
2022-04-26,"Air Liquide gagne un peu plus de 1% à Paris, aidé par une analyse de Credit Suisse qui a rehaussé aujourd'hui son objectif de cours sur le titre de 170 à 195 euros, tout en réitérant sa recommandation d'achat. Du point de vue du broker, le spécialiste des gaz industriels est en train de réussir à saisir l'opportunité que crée la transition énergétique afin de la transformer en croissance rentable. 'Sa part de marché élevée dans les hydrogénoducs (43% au niveau mondial, 85% dans l'UE) et un portefeuille de brevets deux à trois supérieur confère à Air Liquide un avantage sur le segment à forte croissance de la décarbonation, un élément que nous jugeons sous-estimé', explique-t-il dans une note. D'après Credit Suisse, la publication du chiffre d'affaires de premier trimestre, demain, pourrait confirmer cette dynamique favorable dans les énergies vertes compte tenu de la récente mise en place par Bruxelles du plan 'REPowerEU', destiné à réduire la dépendance de l'Europe au gaz russe. Son nouvel objectif de cours fait apparaître un potentiel haussier de l'ordre de 20%.","['gagn', 'peu', 'plus', 'paris', 'aid', 'analys', 'cred', 'suiss', 'a', 'rehauss', 'object', 'cour', 'titr', 'euros', 'tout', 'réiter', 'recommand', 'du', 'point', 'vu', 'brok', 'spécial', 'gaz', 'industriel', 'train', 'réuss', 'sais', 'cré', 'transit', 'énerget', 'afin', 'transform', 'croissanc', 'rentabl', 'part', 'march', 'élev', 'hydrogénoduc', 'niveau', 'mondial', 'portefeuill', 'brevet', 'deux', 'trois', 'supérieur', 'confer', 'avantag', 'segment', 'fort', 'croissanc', 'décarbon', 'élément', 'jugeon', 'not', 'cred', 'suiss', 'publiqu', 'chiffr', 'premi', 'trimestr', 'demain', 'pourr', 'confirm', 'cet', 'dynam', 'favor', 'énerg', 'vert', 'compt', 'tenu', 'récent', 'mis', 'plac', 'bruxel', 'plan', 'destin', 'réduir', 'dépend', 'gaz', 'russ', 'son', 'nouvel', 'object', 'cour', 'fait', 'apparaîtr', 'potentiel', 'haussi']","['Air', 'Liquide', 'gagne', 'peu', 'plus', 'Paris', 'aidé', 'analyse', 'Credit', 'Suisse', 'a', 'rehaussé', 'objectif', 'cours', 'titre', 'euro', 'tout', 'réitérant', 'recommandation', 'Du', 'point', 'vue', 'broker', 'spécialiste', 'gaz', 'industriels', 'train', 'réussir', 'saisir', 'crée', 'transition', 'énergétique', 'afin', 'transformer', 'croissance', 'rentable', 'part', 'marché', 'élevée', 'hydrogénoducs', 'niveau', 'mondial', 'portefeuille', 'brevet', 'deux', 'trois', 'supérieur', 'confère', 'Air', 'Liquide', 'avantage', 'segment', 'forte', 'croissance', 'décarbonation', 'élément', 'jugeons', 'note', 'Credit', 'Suisse', 'publication', 'chiffre', 'premier', 'trimestre', 'demain', 'pourrait', 'confirmer', 'cette', 'dynamique', 'favorable', 'énergies', 'vertes', 'compte', 'tenu', 'récente', 'mise', 'place', 'Bruxelles', 'plan', 'destiné', 'réduire', 'dépendance', 'gaz', 'russe', 'Son', 'nouvel', 'objectif', 'cours', 'fait', 'apparaître', 'potentiel', 'haussier']"
2022-04-26,"Credit Suisse a rehaussé mardi son objectif de cours sur Air Liquide, qu'il porte de 170 à 195 euros, tout en réitérant sa recommandation d'achat sur le titre. Du point de vue du broker, le spécialiste des gaz industriels est en train de réussir à saisir l'opportunité que crée la transition énergétique afin de la transformer en croissance rentable. 'Sa part de marché élevée dans les hydrogénoducs (43% au niveau mondial, 85% dans l'UE) et un portefeuille de brevets deux à trois supérieur confère à Air Liquide un avantage sur le segment à forte croissance de la décarbonation, un élément que nous jugeons sous-estimé', explique-t-il dans une note. D'après Credit Suisse, la publication du chiffre d'affaires de premier trimestre, demain, pourrait confirmer cette dynamique favorable dans les énergies vertes compte tenu de la récente mise en place par Bruxelles du plan 'REPowerEU', destiné à réduire l'indépendance de l'Europe au gaz russe. Son nouvel objectif de cours fait apparaître un potentiel haussier de l'ordre de 20%.","['cred', 'suiss', 'a', 'rehauss', 'mard', 'object', 'cour', 'port', 'euros', 'tout', 'réiter', 'recommand', 'titr', 'du', 'point', 'vu', 'brok', 'spécial', 'gaz', 'industriel', 'train', 'réuss', 'sais', 'cré', 'transit', 'énerget', 'afin', 'transform', 'croissanc', 'rentabl', 'part', 'march', 'élev', 'hydrogénoduc', 'niveau', 'mondial', 'portefeuill', 'brevet', 'deux', 'trois', 'supérieur', 'confer', 'avantag', 'segment', 'fort', 'croissanc', 'décarbon', 'élément', 'jugeon', 'not', 'cred', 'suiss', 'publiqu', 'chiffr', 'premi', 'trimestr', 'demain', 'pourr', 'confirm', 'cet', 'dynam', 'favor', 'énerg', 'vert', 'compt', 'tenu', 'récent', 'mis', 'plac', 'bruxel', 'plan', 'destin', 'réduir', 'gaz', 'russ', 'son', 'nouvel', 'object', 'cour', 'fait', 'apparaîtr', 'potentiel', 'haussi']","['Credit', 'Suisse', 'a', 'rehaussé', 'mardi', 'objectif', 'cours', 'Air', 'Liquide', 'porte', 'euro', 'tout', 'réitérant', 'recommandation', 'titre', 'Du', 'point', 'vue', 'broker', 'spécialiste', 'gaz', 'industriels', 'train', 'réussir', 'saisir', 'crée', 'transition', 'énergétique', 'afin', 'transformer', 'croissance', 'rentable', 'part', 'marché', 'élevée', 'hydrogénoducs', 'niveau', 'mondial', 'portefeuille', 'brevet', 'deux', 'trois', 'supérieur', 'confère', 'Air', 'Liquide', 'avantage', 'segment', 'forte', 'croissance', 'décarbonation', 'élément', 'jugeons', 'note', 'Credit', 'Suisse', 'publication', 'chiffre', 'premier', 'trimestre', 'demain', 'pourrait', 'confirmer', 'cette', 'dynamique', 'favorable', 'énergies', 'vertes', 'compte', 'tenu', 'récente', 'mise', 'place', 'Bruxelles', 'plan', 'destiné', 'réduire', 'gaz', 'russe', 'Son', 'nouvel', 'objectif', 'cours', 'fait', 'apparaître', 'potentiel', 'haussier']"
2022-04-22,"Berenberg a relevé vendredi son objectif de cours sur Air Liquide, qu'il porte de 152 à 160 euros, tout en maintenant une recommandation 'conserver' sur le titre. Dans une note diffusée dans la matinée, le bureau d'études dit s'attendre à une publication 'sans surprise' lors de la présentation du chiffre d'affaires de premier trimestre, prévue le 27 avril. L'analyste explique qu'il considère de façon 'constructive' un investissement dans le spécialiste des gaz industriels, mais rappelle que le cours de son action a signé un bon début d'année, affichant un gain de 5% depuis le 1er janvier contre un repli de 6% pour l'indice sectoriel STOXX Europe 600 Chemicals. Berenberg ajoute qu'un PER situé autour de 25x, comme c'est le cas pour le titre, constitue la norme pour une valeur de croissance affichant une hausse du bénéfice par action (BPA) de l'ordre de 10% an.","['berenberg', 'a', 'relev', 'vendred', 'object', 'cour', 'port', 'euros', 'tout', 'mainten', 'recommand', 'titr', 'dan', 'not', 'diffus', 'matin', 'bureau', 'dit', 'publiqu', 'surpris', 'lor', 'présent', 'chiffr', 'premi', 'trimestr', 'prévu', 'avril', 'expliqu', 'consider', 'façon', 'invest', 'spécial', 'gaz', 'industriel', 'rappel', 'cour', 'action', 'a', 'sign', 'bon', 'début', 'affich', 'gain', 'depuis', 'janvi', 'contr', 'repl', 'sectoriel', 'stoxx', 'europ', 'chemical', 'berenberg', 'ajout', 'per', 'situ', 'autour', 'comm', 'cas', 'titr', 'constitu', 'norm', 'valeur', 'croissanc', 'affich', 'hauss', 'bénéfic', 'action', 'bpa', 'an']","['Berenberg', 'a', 'relevé', 'vendredi', 'objectif', 'cours', 'Air', 'Liquide', 'porte', 'euro', 'tout', 'maintenant', 'recommandation', 'titre', 'Dans', 'note', 'diffusée', 'matinée', 'bureau', 'dit', 'publication', 'surprise', 'lors', 'présentation', 'chiffre', 'premier', 'trimestre', 'prévue', 'avril', 'explique', 'considère', 'façon', 'investissement', 'spécialiste', 'gaz', 'industriels', 'rappelle', 'cours', 'action', 'a', 'signé', 'bon', 'début', 'affichant', 'gain', 'depuis', 'janvier', 'contre', 'repli', 'sectoriel', 'STOXX', 'Europe', 'Chemicals', 'Berenberg', 'ajoute', 'PER', 'situé', 'autour', 'comme', 'ca', 'titre', 'constitue', 'norme', 'valeur', 'croissance', 'affichant', 'hausse', 'bénéfice', 'action', 'BPA', 'an']"
2022-04-12,Air Liquide annonce la vente de ses activités Industriel Marchand situées aux Emirats arabes unis et au Bahreïn au groupe Air Products. Cette transaction comprend la cession d'ALEMIR (Air Liquide Emirates for Industrial Gases) et les parts d'Air Liquide dans MECD (Middle East Carbon Dioxide). ' Cette cession est non significative sur l'ensemble du périmètre d'Air Liquide dans la zone Afrique Moyen Orient et Inde ' indique le groupe.,"['annonc', 'vent', 'activ', 'industriel', 'marchand', 'situ', 'emirat', 'arab', 'unis', 'bahreïn', 'group', 'product', 'cet', 'transact', 'comprend', 'cession', 'emirat', 'for', 'industrial', 'gas', 'part', 'mecd', 'middl', 'east', 'carbon', 'dioxid', 'cet', 'cession', 'non', 'signif', 'périmetr', 'zon', 'afriqu', 'moyen', 'orient', 'inde', 'indiqu', 'group']","['Air', 'Liquide', 'annonce', 'vente', 'activités', 'Industriel', 'Marchand', 'situées', 'Emirats', 'arabes', 'unis', 'Bahreïn', 'groupe', 'Air', 'Products', 'Cette', 'transaction', 'comprend', 'cession', 'Air', 'Liquide', 'Emirates', 'for', 'Industrial', 'Gases', 'part', 'Liquide', 'MECD', 'Middle', 'East', 'Carbon', 'Dioxide', 'Cette', 'cession', 'non', 'significative', 'périmètre', 'Liquide', 'zone', 'Afrique', 'Moyen', 'Orient', 'Inde', 'indique', 'groupe']"
2022-04-07,"Air Liquide publie son premier Rapport de Développement Durable. Celui-ci présente les réalisations du Groupes pour contribuer à une société bas carbone, à un environnement sûr, inclusif et collaboratif et détaille les mesures prises pour avoir un impact positif et durable sur le climat, la santé et l'humain. Depuis 2015, le Groupe a réduit son intensité carbone de 24%, et il est sur la bonne voie pour atteindre son objectif d'une baisse de 30% à l'horizon 2025 grâce à de nombreuses initiatives de décarbonation. Malgré la forte hausse de son activité, ses émissions de CO2 ont augmenté de moins de 1%. L'objectif est de commencer à réduire ses émissions en valeur absolue autour de 2025 pour atteindre la neutralité carbone d'ici 2050.","['publ', 'premi', 'rapport', 'développ', 'durabl', 'présent', 'réalis', 'group', 'contribu', 'societ', 'bas', 'carbon', 'environ', 'sûr', 'inclus', 'collabor', 'détaill', 'mesur', 'pris', 'avoir', 'impact', 'posit', 'durabl', 'climat', 'sant', 'depuis', 'group', 'a', 'réduit', 'intens', 'carbon', 'bon', 'voi', 'atteindr', 'object', 'baiss', 'grâc', 'nombreux', 'initi', 'décarbon', 'malgr', 'fort', 'hauss', 'activ', 'émiss', 'augment', 'moin', 'commenc', 'réduir', 'émiss', 'valeur', 'absolu', 'autour', 'atteindr', 'neutral', 'carbon']","['Air', 'Liquide', 'publie', 'premier', 'Rapport', 'Développement', 'Durable', 'présente', 'réalisations', 'Groupes', 'contribuer', 'société', 'ba', 'carbone', 'environnement', 'sûr', 'inclusif', 'collaboratif', 'détaille', 'mesures', 'prises', 'avoir', 'impact', 'positif', 'durable', 'climat', 'santé', 'Depuis', 'Groupe', 'a', 'réduit', 'intensité', 'carbone', 'bonne', 'voie', 'atteindre', 'objectif', 'baisse', 'grâce', 'nombreuses', 'initiative', 'décarbonation', 'Malgré', 'forte', 'hausse', 'activité', 'émissions', 'augmenté', 'moins', 'commencer', 'réduire', 'émissions', 'valeur', 'absolue', 'autour', 'atteindre', 'neutralité', 'carbone']"
2022-04-05,"Air Liquide et Sogestran annoncent un accord pour créer une coentreprise de solutions de transport, par bateau et par barge, de CO2 liquide en grands volumes, adaptées aux besoins des futurs projets de captage et de séquestration du carbone (CCS) en Europe. 'Cette coentreprise renforcera la position d'Air Liquide sur la chaîne de valeur de la gestion du carbone, qui comprend le captage, la centralisation, le traitement, et le transport vers des sites de séquestration définitive du CO2', explique le fournisseur de gaz industriels. La création de la coentreprise, qui combinera l'expertise d'Air Liquide en matière de CO2 avec celle de Sogestran dans le transport de marchandises à haute valeur ajoutée, est soumise à l'autorisation des autorités compétentes et devrait être achevée d'ici la mi-2022.","['sogestran', 'annoncent', 'accord', 'cré', 'coentrepris', 'solut', 'transport', 'bateau', 'barg', 'grand', 'volum', 'adapt', 'besoin', 'futur', 'projet', 'captag', 'séquestr', 'carbon', 'cc', 'europ', 'coentrepris', 'renforc', 'posit', 'chaîn', 'valeur', 'gestion', 'carbon', 'comprend', 'captag', 'centralis', 'trait', 'transport', 'ver', 'sit', 'séquestr', 'définit', 'expliqu', 'fournisseur', 'gaz', 'industriel', 'la', 'création', 'coentrepris', 'combin', 'mati', 'cel', 'sogestran', 'transport', 'marchandis', 'haut', 'valeur', 'ajout', 'soumis', 'autor', 'compétent', 'devr', 'être', 'achev']","['Air', 'Liquide', 'Sogestran', 'annoncent', 'accord', 'créer', 'coentreprise', 'solution', 'transport', 'bateau', 'barge', 'liquide', 'grand', 'volume', 'adaptées', 'besoins', 'futurs', 'projets', 'captage', 'séquestration', 'carbone', 'CCS', 'Europe', 'coentreprise', 'renforcera', 'position', 'Liquide', 'chaîne', 'valeur', 'gestion', 'carbone', 'comprend', 'captage', 'centralisation', 'traitement', 'transport', 'vers', 'site', 'séquestration', 'définitive', 'explique', 'fournisseur', 'gaz', 'industriels', 'La', 'création', 'coentreprise', 'combinera', 'Liquide', 'matière', 'celle', 'Sogestran', 'transport', 'marchandises', 'haute', 'valeur', 'ajoutée', 'soumise', 'autorités', 'compétentes', 'devrait', 'être', 'achevée']"
2022-04-01,"Air Liquide et EQIOM annoncent s'associer dans le cadre d'un projet baptisé 'K6' dont l'objectif est de transformer l'usine EQIOM de Lumbres, dans les Hauts-de-France, en l'une des premières cimenteries neutres en carbone d'Europe. Le fournisseur français de gaz industriels explique que ce projet vise à capter près de huit millions de tonnes de CO2 sur les dix premières années d'exploitation, grâce à la mise en oeuvre de technologies innovantes. Le projet K6 est l'un des sept projets de dimension industrielle à avoir été sélectionné pour un financement par la Commission européenne dans le cadre de l'édition 2021 de son Fonds consacré à l'innovation, parmi plus de 300 candidatures à subventions.","['eqiom', 'annoncent', 'cadr', 'projet', 'baptis', 'dont', 'transform', 'eqiom', 'lumbr', 'premi', 'cimenter', 'neutr', 'carbon', 'le', 'fournisseur', 'franc', 'gaz', 'industriel', 'expliqu', 'projet', 'vis', 'capt', 'pres', 'huit', 'million', 'ton', 'dix', 'premi', 'anné', 'grâc', 'mis', 'oeuvr', 'technolog', 'innov', 'le', 'projet', 'sept', 'projet', 'dimens', 'industriel', 'avoir', 'sélection', 'financ', 'commiss', 'européen', 'cadr', 'fond', 'consacr', 'parm', 'plus', 'candidatur', 'subvent']","['Air', 'Liquide', 'EQIOM', 'annoncent', 'cadre', 'projet', 'baptisé', 'dont', 'transformer', 'EQIOM', 'Lumbres', 'premières', 'cimenteries', 'neutres', 'carbone', 'Le', 'fournisseur', 'français', 'gaz', 'industriels', 'explique', 'projet', 'vise', 'capter', 'près', 'huit', 'million', 'tonne', 'dix', 'premières', 'années', 'grâce', 'mise', 'oeuvre', 'technology', 'innovantes', 'Le', 'projet', 'sept', 'projets', 'dimension', 'industrielle', 'avoir', 'sélectionné', 'financement', 'Commission', 'européenne', 'cadre', 'Fonds', 'consacré', 'parmi', 'plus', 'candidature', 'subvention']"
