date,content,cleaned_article_stemming,cleaned_article_lemmatization
2020-07-27,"Air Liquide a signé un contrat d'achat à long terme pour se fournir en électricité renouvelable à hauteur de 15% de la consommation actuelle de ses activités en Espagne. Le groupe souhaite accroître de près de 70% ses achats d'électricité renouvelable à horizon 2025 (en comparaison de 2015). Grâce à cet accord de long terme d'une durée de 10 ans, Air Liquide pourra recourir à des sources d'énergie renouvelables pour fournir certains de ses actifs de production de gaz industriels et médicaux en Espagne. La ferme éolienne qui fournira Air Liquide en électricité renouvelable, pour l'équivalent de la consommation électrique annuelle de 15 000 foyers, est en cours de développement en Andalousie et devrait être opérationnelle en 2021.","['a', 'sign', 'contrat', 'long', 'term', 'fourn', 'électr', 'renouvel', 'hauteur', 'consomm', 'actuel', 'activ', 'espagn', 'le', 'group', 'souhait', 'accroîtr', 'pres', 'achat', 'renouvel', 'horizon', 'comparaison', 'grâc', 'cet', 'accord', 'long', 'term', 'dur', 'an', 'pourr', 'recour', 'sourc', 'renouvel', 'fourn', 'certain', 'actif', 'product', 'gaz', 'industriel', 'médical', 'espagn', 'la', 'ferm', 'éolien', 'fourn', 'électr', 'renouvel', 'consomm', 'électr', 'annuel', 'foyer', 'cour', 'développ', 'andalous', 'devr', 'être', 'opérationnel']","['Air', 'Liquide', 'a', 'signé', 'contrat', 'long', 'terme', 'fournir', 'électricité', 'renouvelable', 'hauteur', 'consommation', 'actuelle', 'activités', 'Espagne', 'Le', 'groupe', 'souhaite', 'accroître', 'près', 'achats', 'renouvelable', 'horizon', 'comparaison', 'Grâce', 'cet', 'accord', 'long', 'terme', 'durée', 'an', 'Air', 'Liquide', 'pourra', 'recourir', 'source', 'renouvelables', 'fournir', 'certains', 'actifs', 'production', 'gaz', 'industriels', 'médicaux', 'Espagne', 'La', 'ferme', 'éolienne', 'fournira', 'Air', 'Liquide', 'électricité', 'renouvelable', 'consommation', 'électrique', 'annuelle', 'foyer', 'cours', 'développement', 'Andalousie', 'devrait', 'être', 'opérationnelle']"
2020-07-23,"Air Liquide annonce un investissement de 125 millions d'euros pour construire la première unité de séparation des gaz de l'air (ASU) de taille mondiale pour la production d'oxygène comprenant un système de stockage d'énergie. Le groupe de gaz industriels explique que cette ASU ayant une consommation électrique réduite d'environ 10%, aura une capacité de production de 2.200 tonnes d'oxygène par jour. Construite dans le port de Moerdijk aux Pays-Bas, elle devrait être opérationnelle en 2022.","['annonc', 'invest', 'million', 'construir', 'premi', 'unit', 'sépar', 'gaz', 'asu', 'taill', 'mondial', 'product', 'compren', 'system', 'stockag', 'le', 'group', 'gaz', 'industriel', 'expliqu', 'cet', 'asu', 'consomm', 'électr', 'réduit', 'capac', 'product', 'ton', 'jour', 'construit', 'port', 'moerdijk', 'devr', 'être', 'opérationnel']","['Air', 'Liquide', 'annonce', 'investissement', 'million', 'construire', 'première', 'unité', 'séparation', 'gaz', 'ASU', 'taille', 'mondiale', 'production', 'comprenant', 'système', 'stockage', 'Le', 'groupe', 'gaz', 'industriels', 'explique', 'cette', 'ASU', 'consommation', 'électrique', 'réduite', 'capacité', 'production', 'tonne', 'jour', 'Construite', 'port', 'Moerdijk', 'devrait', 'être', 'opérationnelle']"
2020-07-16,"Air Liquide annonce la signature d'un nouveau partenariat de long terme avec le producteur d'acier russe NLMK, par lequel le fournisseur de gaz industriels investira environ 100 millions d'euros sur le site de NLMK situé à Lipetsk. Cet investissement portera sur trois projets dont la construction d'une unité de séparation d'air de dernière génération, l'acquisition de l'unité d'hydrogène existante sur le site et l'unité de production des gaz rares. 'Cette opération constitue également le socle de la croissance de l'activité Industriel Marchand d'Air Liquide sur un des marchés les plus importants dans la région de Moscou', ajoute le groupe français.","['annonc', 'signatur', 'nouveau', 'partenariat', 'long', 'term', 'producteur', 'russ', 'nlmk', 'lequel', 'fournisseur', 'gaz', 'industriel', 'invest', 'environ', 'million', 'sit', 'nlmk', 'situ', 'lipetsk', 'cet', 'invest', 'port', 'trois', 'projet', 'dont', 'construct', 'unit', 'sépar', 'derni', 'géner', 'exist', 'sit', 'product', 'gaz', 'rar', 'oper', 'constitu', 'égal', 'socl', 'croissanc', 'industriel', 'marchand', 'march', 'plus', 'import', 'région', 'moscou', 'ajout', 'group', 'franc']","['Air', 'Liquide', 'annonce', 'signature', 'nouveau', 'partenariat', 'long', 'terme', 'producteur', 'russe', 'NLMK', 'lequel', 'fournisseur', 'gaz', 'industriels', 'investira', 'environ', 'million', 'site', 'NLMK', 'situé', 'Lipetsk', 'Cet', 'investissement', 'portera', 'trois', 'projets', 'dont', 'construction', 'unité', 'séparation', 'dernière', 'génération', 'existante', 'site', 'production', 'gaz', 'rares', 'opération', 'constitue', 'également', 'socle', 'croissance', 'Industriel', 'Marchand', 'Liquide', 'marchés', 'plus', 'importants', 'région', 'Moscou', 'ajoute', 'groupe', 'français']"
2020-07-07,"Le groupe Air Liquide annonce avoir signé un contrat de long terme avec Steel Dynamics, un des plus grands groupes de production d'acier et de recyclage de métaux aux États-Unis. Ce contrat repose sur la fourniture de l'oxygène, de l'azote et de l'argon à la nouvelle aciérie à four électrique de Steel Dynamics implantée à Sinton, au Texas. 'Pour honorer ce nouveau contrat, Air Liquide prévoit d'investir plus de 100 millions de dollars américains dans la construction d'une unité de séparation des gaz de l'air (ASU) au sein de son réseau de canalisations de la côte du Golfe du Mexique à Ingleside, au Texas, ainsi que de raccorder le site de SDI à son réseau de canalisations', indique le groupe.","['le', 'group', 'annonc', 'avoir', 'sign', 'contrat', 'long', 'term', 'steel', 'dynamic', 'plus', 'grand', 'group', 'product', 'recyclag', 'métal', 'ce', 'contrat', 'repos', 'fournitur', 'nouvel', 'acier', 'four', 'électr', 'steel', 'dynamic', 'implant', 'sinton', 'tex', 'honor', 'nouveau', 'contrat', 'prévoit', 'plus', 'million', 'dollar', 'américain', 'construct', 'unit', 'sépar', 'gaz', 'asu', 'sein', 'réseau', 'canalis', 'côt', 'golf', 'mexiqu', 'inglesid', 'tex', 'ains', 'raccord', 'sit', 'sdi', 'réseau', 'canalis', 'indiqu', 'group']","['Le', 'groupe', 'Air', 'Liquide', 'annonce', 'avoir', 'signé', 'contrat', 'long', 'terme', 'Steel', 'Dynamics', 'plus', 'grand', 'groupes', 'production', 'recyclage', 'métaux', 'Ce', 'contrat', 'repose', 'fourniture', 'nouvelle', 'aciérie', 'four', 'électrique', 'Steel', 'Dynamics', 'implantée', 'Sinton', 'Texas', 'honorer', 'nouveau', 'contrat', 'Air', 'Liquide', 'prévoit', 'plus', 'million', 'dollar', 'américains', 'construction', 'unité', 'séparation', 'gaz', 'ASU', 'sein', 'réseau', 'canalisation', 'côte', 'Golfe', 'Mexique', 'Ingleside', 'Texas', 'ainsi', 'raccorder', 'site', 'SDI', 'réseau', 'canalisation', 'indique', 'groupe']"
2020-07-06,"Air Liquide et le port de Rotterdam annoncent ce soir le lancement d'une initiative conjointe ayant pour objectif de permettre à 1.000 camions hydrogène zéro émission de relier les Pays-Bas, la Belgique et l'Allemagne de l'Ouest d'ici 2025. 'Plusieurs partenaires représentant l'ensemble de la chaîne d'approvisionnement, depuis des constructeurs de camions tels que VDL Groep et Iveco/Nikola jusqu à des sociétés de transport comme Vos Logistics, Jongeneel Transport et HN Post, ainsi que des fournisseurs majeurs de piles à combustible ont déjà accepté de s'y joindre. Il s'agit de l'un des plus grands projets européens de développement de camions à hydrogène et d'infrastructures connexes', indique Air Liquide. Ce projet doit contribuer à améliorer la qualité de l'air en réduisant les émissions de CO2 d'environ 100.000 tonnes par an.","['port', 'rotterdam', 'annoncent', 'soir', 'lanc', 'initi', 'conjoint', 'object', 'permettr', 'camion', 'hydrogen', 'zéro', 'émiss', 'reli', 'belgiqu', 'partenair', 'représent', 'chaîn', 'depuis', 'constructeur', 'camion', 'tel', 'vdl', 'groep', 'jusqu', 'societ', 'transport', 'comm', 'vos', 'logistic', 'jongeneel', 'transport', 'hn', 'post', 'ains', 'fournisseur', 'majeur', 'pil', 'combustibl', 'déjà', 'accept', 'joindr', 'il', 'plus', 'grand', 'projet', 'européen', 'développ', 'camion', 'hydrogen', 'connex', 'indiqu', 'ce', 'projet', 'doit', 'contribu', 'amélior', 'qualit', 'réduis', 'émiss', 'ton', 'an']","['Air', 'Liquide', 'port', 'Rotterdam', 'annoncent', 'soir', 'lancement', 'initiative', 'conjointe', 'objectif', 'permettre', 'camion', 'hydrogène', 'zéro', 'émission', 'relier', 'Belgique', 'partenaires', 'représentant', 'chaîne', 'depuis', 'constructeurs', 'camion', 'tels', 'VDL', 'Groep', 'jusqu', 'sociétés', 'transport', 'comme', 'Vos', 'Logistics', 'Jongeneel', 'Transport', 'HN', 'Post', 'ainsi', 'fournisseurs', 'majeurs', 'pile', 'combustible', 'déjà', 'accepté', 'joindre', 'Il', 'plus', 'grand', 'projets', 'européens', 'développement', 'camion', 'hydrogène', 'connexes', 'indique', 'Air', 'Liquide', 'Ce', 'projet', 'doit', 'contribuer', 'améliorer', 'qualité', 'réduisant', 'émissions', 'tonne', 'an']"
2020-07-01,"Air Liquide annonce la construction de la première station hydrogène haute pression d'Europe. Située sur son site de Fos-sur-Mer, cette station de grande capacité alimentera la première flotte de camions à hydrogène effectuant de longues distances. La station sera mise en service début 2022 et permettra jusqu'à 20 rechargements journaliers de camions hydrogène bas carbone effectuant de longue distance, avec une autonomie qui pourra aller jusqu'à 800 km. Elle sera construite dans le cadre du projet HyAMMED qui regroupe industriels, transporteurs et acteurs de la grande distribution, et permettra de réduire les émissions de CO2 de plus de 1.500 tonnes par an.","['annonc', 'construct', 'premi', 'station', 'hydrogen', 'haut', 'pression', 'situ', 'sit', 'cet', 'station', 'grand', 'capac', 'aliment', 'premi', 'flott', 'camion', 'hydrogen', 'effectu', 'longu', 'distanc', 'la', 'station', 'mis', 'servic', 'début', 'permettr', 'jusqu', 'recharg', 'journali', 'camion', 'hydrogen', 'bas', 'carbon', 'effectu', 'longu', 'distanc', 'autonom', 'pourr', 'aller', 'jusqu', 'km', 'elle', 'construit', 'cadr', 'projet', 'hyammed', 'regroup', 'industriel', 'transporteur', 'acteur', 'grand', 'distribu', 'permettr', 'réduir', 'émiss', 'plus', 'ton', 'an']","['Air', 'Liquide', 'annonce', 'construction', 'première', 'station', 'hydrogène', 'haute', 'pression', 'Située', 'site', 'cette', 'station', 'grande', 'capacité', 'alimentera', 'première', 'flotte', 'camion', 'hydrogène', 'effectuant', 'longues', 'distance', 'La', 'station', 'mise', 'service', 'début', 'permettra', 'jusqu', 'rechargements', 'journaliers', 'camion', 'hydrogène', 'ba', 'carbone', 'effectuant', 'longue', 'distance', 'autonomie', 'pourra', 'aller', 'jusqu', 'km', 'Elle', 'construite', 'cadre', 'projet', 'HyAMMED', 'regroupe', 'industriels', 'transporteurs', 'acteurs', 'grande', 'distribution', 'permettra', 'réduire', 'émissions', 'plus', 'tonne', 'an']"
2020-05-27,"La société BlackRock agissant pour le compte de clients et de fonds dont elle assure la gestion, a déclaré avoir franchi en baisse, le 25 mai 2020, les seuils de 5% du capital et des droits de vote de la société L'Air Liquide et détenir, pour le compte desdits clients et fonds, 23 058 650 actions L'Air Liquide représentant autant de droits de vote, soit 4,87% du capital et des droits de vote de cette société. Ce franchissement de seuils résulte d'une cession d'actions L'Air Liquide hors et sur le marché et d'une diminution du nombre d'actions L'Air Liquide détenues à titre de collatéral.","['la', 'societ', 'blackrock', 'agiss', 'compt', 'client', 'fond', 'dont', 'assur', 'gestion', 'a', 'déclar', 'avoir', 'franch', 'baiss', 'mai', 'seuil', 'capital', 'droit', 'vot', 'societ', 'déten', 'compt', 'desdit', 'client', 'fond', 'action', 'représent', 'aut', 'droit', 'vot', 'capital', 'droit', 'vot', 'cet', 'societ', 'ce', 'franch', 'seuil', 'résult', 'cession', 'hor', 'march', 'diminu', 'nombr', 'détenu', 'titr', 'collatéral']","['La', 'société', 'BlackRock', 'agissant', 'compte', 'client', 'fonds', 'dont', 'assure', 'gestion', 'a', 'déclaré', 'avoir', 'franchi', 'baisse', 'mai', 'seuils', 'capital', 'droits', 'vote', 'société', 'Liquide', 'détenir', 'compte', 'desdits', 'client', 'fonds', 'action', 'Liquide', 'représentant', 'autant', 'droits', 'vote', 'capital', 'droits', 'vote', 'cette', 'société', 'Ce', 'franchissement', 'seuils', 'résulte', 'cession', 'Liquide', 'hors', 'marché', 'diminution', 'nombre', 'Liquide', 'détenues', 'titre', 'collatéral']"
2020-05-25,"BlackRock, agissant pour le compte de clients et de fonds, a déclaré à l'AMF avoir franchi en hausse, le 21 mai, les seuils de 5% du capital et des droits de vote d'Air Liquide et détenir 5,01% du capital et des droits de vote du groupe de gaz industriels. Le gestionnaire d'actifs américain précise que ce franchissement de seuils résulte d'une acquisition d'actions Air Liquide hors et sur le marché et d'une augmentation du nombre d'actions détenues à titre de collatéral.","['blackrock', 'agiss', 'compt', 'client', 'fond', 'a', 'déclar', 'avoir', 'franch', 'hauss', 'mai', 'seuil', 'capital', 'droit', 'vot', 'déten', 'capital', 'droit', 'vot', 'group', 'gaz', 'industriel', 'le', 'gestionnair', 'américain', 'précis', 'franch', 'seuil', 'résult', 'acquisit', 'hor', 'march', 'augment', 'nombr', 'détenu', 'titr', 'collatéral']","['BlackRock', 'agissant', 'compte', 'client', 'fonds', 'a', 'déclaré', 'avoir', 'franchi', 'hausse', 'mai', 'seuils', 'capital', 'droits', 'vote', 'Liquide', 'détenir', 'capital', 'droits', 'vote', 'groupe', 'gaz', 'industriels', 'Le', 'gestionnaire', 'américain', 'précise', 'franchissement', 'seuils', 'résulte', 'acquisition', 'Air', 'Liquide', 'hors', 'marché', 'augmentation', 'nombre', 'détenues', 'titre', 'collatéral']"
2020-05-25,"La société BlackRock agissant pour le compte de clients et de fonds dont elle assure la gestion, a déclaré à l'AMF avoir franchi en baisse, le 20 mai 2020, les seuils de 5% du capital et des droits de vote de la société L'Air Liquide et détenir, pour le compte desdits clients et fonds, 23 627 235 actions L'Air Liquide représentant autant de droits de vote, soit 4,99% du capital et des droits de vote de cette société. Ce franchissement de seuils résulte d'une diminution du nombre d'actions L'Air Liquide détenues à titre de collatéral.","['la', 'societ', 'blackrock', 'agiss', 'compt', 'client', 'fond', 'dont', 'assur', 'gestion', 'a', 'déclar', 'avoir', 'franch', 'baiss', 'mai', 'seuil', 'capital', 'droit', 'vot', 'societ', 'déten', 'compt', 'desdit', 'client', 'fond', 'action', 'représent', 'aut', 'droit', 'vot', 'capital', 'droit', 'vot', 'cet', 'societ', 'ce', 'franch', 'seuil', 'résult', 'diminu', 'nombr', 'détenu', 'titr', 'collatéral']","['La', 'société', 'BlackRock', 'agissant', 'compte', 'client', 'fonds', 'dont', 'assure', 'gestion', 'a', 'déclaré', 'avoir', 'franchi', 'baisse', 'mai', 'seuils', 'capital', 'droits', 'vote', 'société', 'Liquide', 'détenir', 'compte', 'desdits', 'client', 'fonds', 'action', 'Liquide', 'représentant', 'autant', 'droits', 'vote', 'capital', 'droits', 'vote', 'cette', 'société', 'Ce', 'franchissement', 'seuils', 'résulte', 'diminution', 'nombre', 'Liquide', 'détenues', 'titre', 'collatéral']"
2020-05-19,"La société BlackRock agissant pour le compte de clients et de fonds dont elle assure la gestion, a déclaré avoir franchi en hausse, le 18 mai 2020, les seuils de 5% du capital et des droits de vote de la société L'Air Liquide et détenir, pour le compte desdits clients et fonds, 23 786 691 actions L'Air Liquide représentant autant de droits de vote, soit 5,02% du capital et des droits de vote de cette société. Ce franchissement de seuils résulte d'une acquisition d'actions L'Air Liquide sur le marché et d'une augmentation du nombre d'actions L'Air Liquide détenues à titre de collatéral.","['la', 'societ', 'blackrock', 'agiss', 'compt', 'client', 'fond', 'dont', 'assur', 'gestion', 'a', 'déclar', 'avoir', 'franch', 'hauss', 'mai', 'seuil', 'capital', 'droit', 'vot', 'societ', 'déten', 'compt', 'desdit', 'client', 'fond', 'action', 'représent', 'aut', 'droit', 'vot', 'capital', 'droit', 'vot', 'cet', 'societ', 'ce', 'franch', 'seuil', 'résult', 'acquisit', 'march', 'augment', 'nombr', 'détenu', 'titr', 'collatéral']","['La', 'société', 'BlackRock', 'agissant', 'compte', 'client', 'fonds', 'dont', 'assure', 'gestion', 'a', 'déclaré', 'avoir', 'franchi', 'hausse', 'mai', 'seuils', 'capital', 'droits', 'vote', 'société', 'Liquide', 'détenir', 'compte', 'desdits', 'client', 'fonds', 'action', 'Liquide', 'représentant', 'autant', 'droits', 'vote', 'capital', 'droits', 'vote', 'cette', 'société', 'Ce', 'franchissement', 'seuils', 'résulte', 'acquisition', 'Liquide', 'marché', 'augmentation', 'nombre', 'Liquide', 'détenues', 'titre', 'collatéral']"
2020-05-19,"BlackRock, agissant pour le compte de clients et de fonds, a déclaré à l'AMF avoir franchi en hausse, le 18 mai, les seuils de 5% du capital et des droits de vote d'Air Liquide et détenir 5,02% du capital et des droits de vote du fournisseur de gaz industriels. Le gestionnaire d'actifs américain précise que ce franchissement de seuils résulte d'une acquisition d'actions Air Liquide sur le marché et d'une augmentation du nombre d'actions détenues à titre de collatéral.","['blackrock', 'agiss', 'compt', 'client', 'fond', 'a', 'déclar', 'avoir', 'franch', 'hauss', 'mai', 'seuil', 'capital', 'droit', 'vot', 'déten', 'capital', 'droit', 'vot', 'fournisseur', 'gaz', 'industriel', 'le', 'gestionnair', 'américain', 'précis', 'franch', 'seuil', 'résult', 'acquisit', 'march', 'augment', 'nombr', 'détenu', 'titr', 'collatéral']","['BlackRock', 'agissant', 'compte', 'client', 'fonds', 'a', 'déclaré', 'avoir', 'franchi', 'hausse', 'mai', 'seuils', 'capital', 'droits', 'vote', 'Liquide', 'détenir', 'capital', 'droits', 'vote', 'fournisseur', 'gaz', 'industriels', 'Le', 'gestionnaire', 'américain', 'précise', 'franchissement', 'seuils', 'résulte', 'acquisition', 'Air', 'Liquide', 'marché', 'augmentation', 'nombre', 'détenues', 'titre', 'collatéral']"
2020-05-04,"Le groupe Air Liquide annonce avoir finalisé la cession de ses entités en République tchèque et en Slovaquie au groupe Messer. 'Cette décision reflète la stratégie d'Air Liquide de revue régulière de son portefeuille d'activités afin d'accroître sa présence dans des régions clés, pour renforcer sa densité géographique, et dès lors sa performance', explique le groupe. Le montant de la transaction n'a pas été annoncé.","['le', 'group', 'annonc', 'avoir', 'finalis', 'cession', 'entit', 'républ', 'tchequ', 'slovaqu', 'group', 'mess', 'décis', 'reflet', 'strateg', 'revu', 'réguli', 'portefeuill', 'afin', 'présenc', 'région', 'clé', 'renforc', 'densit', 'géograph', 'des', 'lor', 'perform', 'expliqu', 'group', 'le', 'mont', 'transact', 'a', 'annonc']","['Le', 'groupe', 'Air', 'Liquide', 'annonce', 'avoir', 'finalisé', 'cession', 'entités', 'République', 'tchèque', 'Slovaquie', 'groupe', 'Messer', 'décision', 'reflète', 'stratégie', 'Liquide', 'revue', 'régulière', 'portefeuille', 'afin', 'présence', 'régions', 'clés', 'renforcer', 'densité', 'géographique', 'dès', 'lors', 'performance', 'explique', 'groupe', 'Le', 'montant', 'transaction', 'a', 'annoncé']"
2020-04-27,"Crédit Suisse réduit ses prévisions de BPA de 5% au cours de l'exercice 2020. Le bureau d'analyses maintient sa recommandation à surperformance sur la valeur avec un objectif de 130 E. ' Air Liquide se négocie avec une remise de 8% par rapport à ses homologues américains ' indique le bureau d'analyses. ' Nous pensons qu'Air Liquide dispose d'un certain nombre de leviers pour protéger les bénéfices et la génération de cash tout au long du cycle '. Nous prévoyons un rendement du Free Cash Flow sur l'année 2020 de 6% ' rajoute Crédit Suisse. ' Les opportunités de fusions et acquisitions étant limitées, nous pensons qu'Air Liquide continuera de se concentrer sur l'augmentation progressive des rendements pour les actionnaires '.","['cred', 'suiss', 'réduit', 'prévis', 'bpa', 'cour', 'le', 'bureau', 'maintient', 'recommand', 'surperform', 'valeur', 'object', 'négoc', 'remis', 'rapport', 'homologu', 'américain', 'indiqu', 'bureau', 'nous', 'penson', 'dispos', 'certain', 'nombr', 'levi', 'proteg', 'bénéfic', 'géner', 'cash', 'tout', 'long', 'cycl', 'nous', 'prévoyon', 'rend', 'fre', 'cash', 'flow', 'rajout', 'cred', 'suiss', 'le', 'opportun', 'fusion', 'acquisit', 'limit', 'penson', 'continu', 'concentr', 'progress', 'rend', 'actionnair']","['Crédit', 'Suisse', 'réduit', 'prévisions', 'BPA', 'cours', 'Le', 'bureau', 'maintient', 'recommandation', 'surperformance', 'valeur', 'objectif', 'Air', 'Liquide', 'négocie', 'remise', 'rapport', 'homologues', 'américains', 'indique', 'bureau', 'Nous', 'pensons', 'Liquide', 'dispose', 'certain', 'nombre', 'leviers', 'protéger', 'bénéfices', 'génération', 'cash', 'tout', 'long', 'cycle', 'Nous', 'prévoyons', 'rendement', 'Free', 'Cash', 'Flow', 'rajoute', 'Crédit', 'Suisse', 'Les', 'opportunités', 'fusion', 'acquisition', 'limitées', 'pensons', 'Liquide', 'continuera', 'concentrer', 'progressive', 'rendements', 'actionnaires']"
2020-04-27,"Crédit Suisse réduit ses prévisions de BPA de 5% au cours de l'exercice 2020. Le bureau d'analyses maintient sa recommandation à surperformance sur la valeur avec un objectif de 130 E. ' Air Liquide se négocie avec une remise de 8% par rapport à ses homologues américains ' indique le bureau d'analyses. ' Nous pensons qu'Air Liquide dispose d'un certain nombre de leviers pour protéger les bénéfices et la génération de cash tout au long du cycle '. Nous prévoyons un rendement du Free Cash Flow sur l'année 2020 de 6% ' rajoute Crédit Suisse. ' Les opportunités de fusions et acquisitions étant limitées, nous pensons qu'Air Liquide continuera de se concentrer sur l'augmentation progressive des rendements pour les actionnaires '.","['cred', 'suiss', 'réduit', 'prévis', 'bpa', 'cour', 'le', 'bureau', 'maintient', 'recommand', 'surperform', 'valeur', 'object', 'négoc', 'remis', 'rapport', 'homologu', 'américain', 'indiqu', 'bureau', 'nous', 'penson', 'dispos', 'certain', 'nombr', 'levi', 'proteg', 'bénéfic', 'géner', 'cash', 'tout', 'long', 'cycl', 'nous', 'prévoyon', 'rend', 'fre', 'cash', 'flow', 'rajout', 'cred', 'suiss', 'le', 'opportun', 'fusion', 'acquisit', 'limit', 'penson', 'continu', 'concentr', 'progress', 'rend', 'actionnair']","['Crédit', 'Suisse', 'réduit', 'prévisions', 'BPA', 'cours', 'Le', 'bureau', 'maintient', 'recommandation', 'surperformance', 'valeur', 'objectif', 'Air', 'Liquide', 'négocie', 'remise', 'rapport', 'homologues', 'américains', 'indique', 'bureau', 'Nous', 'pensons', 'Liquide', 'dispose', 'certain', 'nombre', 'leviers', 'protéger', 'bénéfices', 'génération', 'cash', 'tout', 'long', 'cycle', 'Nous', 'prévoyons', 'rendement', 'Free', 'Cash', 'Flow', 'rajoute', 'Crédit', 'Suisse', 'Les', 'opportunités', 'fusion', 'acquisition', 'limitées', 'pensons', 'Liquide', 'continuera', 'concentrer', 'progressive', 'rendements', 'actionnaires']"
2020-04-27,"Crédit Suisse réduit ses prévisions de BPA de 5% au cours de l'exercice 2010. Le bureau d'analyses maintient sa recommandation à surperformance sur la valeur avec un objectif de 130 E. ' Air Liquide se négocie avec une remise de 8% par rapport à ses homologues américains ' indique le bureau d'analyses. ' Nous pensons qu'Air Liquide dispose d'un certain nombre de leviers pour protéger les bénéfices et la génération de cash tout au long du cycle '. Nous prévoyons un rendement du Free Cash Flow sur l'année 2020 de 6% ' rajoute Crédit Suisse. ' Les opportunités de fusions et acquisitions étant limitées, nous pensons qu'Air Liquide continuera de se concentrer sur l'augmentation progressive des rendements pour les actionnaires '.","['cred', 'suiss', 'réduit', 'prévis', 'bpa', 'cour', 'le', 'bureau', 'maintient', 'recommand', 'surperform', 'valeur', 'object', 'négoc', 'remis', 'rapport', 'homologu', 'américain', 'indiqu', 'bureau', 'nous', 'penson', 'dispos', 'certain', 'nombr', 'levi', 'proteg', 'bénéfic', 'géner', 'cash', 'tout', 'long', 'cycl', 'nous', 'prévoyon', 'rend', 'fre', 'cash', 'flow', 'rajout', 'cred', 'suiss', 'le', 'opportun', 'fusion', 'acquisit', 'limit', 'penson', 'continu', 'concentr', 'progress', 'rend', 'actionnair']","['Crédit', 'Suisse', 'réduit', 'prévisions', 'BPA', 'cours', 'Le', 'bureau', 'maintient', 'recommandation', 'surperformance', 'valeur', 'objectif', 'Air', 'Liquide', 'négocie', 'remise', 'rapport', 'homologues', 'américains', 'indique', 'bureau', 'Nous', 'pensons', 'Liquide', 'dispose', 'certain', 'nombre', 'leviers', 'protéger', 'bénéfices', 'génération', 'cash', 'tout', 'long', 'cycle', 'Nous', 'prévoyons', 'rendement', 'Free', 'Cash', 'Flow', 'rajoute', 'Crédit', 'Suisse', 'Les', 'opportunités', 'fusion', 'acquisition', 'limitées', 'pensons', 'Liquide', 'continuera', 'concentrer', 'progressive', 'rendements', 'actionnaires']"
